flags,instruction,category,intent,response
BQZ,I'm rtying to cancel order {{Order Number}},ORDER,cancel_order,"I'm following the urgency of canceling your order with the order number {{Order Number}}. I apologize for any inconvenience caused. To assist you with the cancellation process, please follow these steps:

1. Log into your {{Online Company Portal Info}}.
2. Navigate to the '{{Online Order Interaction}}' or '{{Online Order Interaction}}' section.
3. Look for the order with the number {{Order Number}} and click on it.
4. You should see an option to '{{Online Order Interaction}}', please select that.
5. Follow the instructions, if any, to complete the cancellation.

If you encounter any difficulties or have any further questions, please do not hesitate to reach out to our dedicated customer support team. You can contact us during {{Customer Support Hours}} at {{Customer Support Phone Number}} or through the Live Chat function on our {{Website URL}}. We are here to help and ensure your satisfaction."
BQZ,i need help trackng order {{Order Number}},ORDER,track_order,"We're here to help! I take note that you need assistance in tracking order number {{Order Number}}. I'm here to help you with that. In order to provide you with the most accurate information, could you please verify your account details? This will ensure that I have access to the correct order information and can assist you effectively."
BILZ,hw can I modify purchase {{Order Number}}?,ORDER,change_order,"We appreciate your inquiry regarding the modification of purchase {{Order Number}}. We are here to assist you with any changes you would like to make. To better understand your specific needs, could you please provide some details about the modifications you would like to make to your purchase? This will help us provide you with accurate guidance and ensure that your purchase meets your expectations. We are committed to your satisfaction and look forward to helping you with your purchase modification."
BLMZ,hep changing some products of an order,ORDER,change_order,"Appreciate your message to us for assistance with changing the products in your order. We understand that it's important for you to have the right items. To help you with this, could you please provide the order number and specify which products you would like to change? This way, we can ensure that your order is exactly as you want it. We're here to support you throughout the process, so please feel free to ask any questions or share any additional details that may help us fulfill your request."
BKL,show me estimated time of arrival of order {{Order Number}},ORDER,track_order,"Honored to assist! I'm clued in that you would like to know the estimated time of arrival (ETA) for your order with the order number {{Order Number}}. To provide you with accurate information, I kindly request you to hang on while I check the latest updates from our logistics team. I appreciate your patience in this matter as ensuring the ETA's accuracy is crucial. In the meantime, if you have any other questions or need further assistance, please don't hesitate to let me know."
BLQ,i forgot to include an item in purchase {{Order Number}},ORDER,change_order,"We understand that you forgot to include an item in your purchase with the number #{{Order Number}}. We apologize for any inconvenience this may have caused. To address this issue, we recommend contacting our customer support team as soon as possible. They will assist you in adding the missing item to your purchase. Remember, your satisfaction is our top priority, and we are here to help ensure your order is just as you envision it. Please don't hesitate to reach out to our customer support team for further assistance."
BL,switch something of order {{Order Number}},ORDER,change_order,Thank you for reaching out! I completely understand that you're looking to switch something in your order with the number {{Order Number}}. I'm here to help you with that. Could you please provide me with more details about what you'd like to switch? This will allow me to assist you more effectively.
BIL,is it possible to swap an item of purchase {{Order Number}}?,ORDER,change_order,"We appreciate your inquiry regarding the possibility of swapping an item for purchase number {{Order Number}}. Making changes to an existing purchase is important, and we are here to assist you. Please provide us with the details of the item you would like to swap, and we will ensure to provide you with the necessary guidance and options for a smooth exchange process. Your satisfaction is our top priority, and we are committed to making sure your purchase meets your expectations."
BLM,I need assistance to shop some articles,ORDER,place_order,"Thank you for reaching out! I'm here to provide you the assistance you need in shopping for the articles you desire. I understand that you require guidance, and I assure you that I'll be with you every step of the way. To begin, could you please let me know the specific articles you are interested in? Providing me with additional details such as preferences, sizes, or colors will allow me to tailor my recommendations to your needs. Together, we'll make sure you find the perfect articles and have a seamless shopping experience."
BIL,can you help me seeing the ETA of the order {{Order Number}}?,ORDER,track_order,"Sure! I'm here to assist you in checking the Estimated Time of Arrival (ETA) for your order with the number {{Order Number}}. The ETA can vary based on various factors such as shipping method, distance, and any unforeseen circumstances. To provide you with the most accurate information, could you please provide me with your order number once again? That way, I can quickly look up the details and let you know the ETA. Thank you for your cooperation, and I'm here to help you every step of the way!"
BLQ,need help with switching a product of order {{Order Number}},ORDER,change_order,"I realized that you need assistance with switching a product in your order with the number {{Order Number}}. Thank you for bringing this to our attention. To proceed with the exchange, could you please provide me with the details of the item you would like to switch and the replacement product you would like to receive? This will help us ensure a seamless transition and make sure you're satisfied with your order."
BILQ,how do i delete a product from order {{Order Number}},ORDER,change_order,"Thanks for dropping us a line to us with your query about removing a product from order number {{Order Number}}. I understand the importance of making adjustments to your order, and I'm here to help. To remove a product, you can follow these steps:

1. Log in to your account on our website.
2. Navigate to the ""Orders"" section or ""Order History.""
3. Locate and select the specific order (order number: {{Order Number}}).
4. Find the product you wish to delete and click on the ""Remove"" button or link next to it.
5. Confirm the deletion when prompted.
6. Your order will be updated, and the product will be removed.

If you encounter any difficulties or require further assistance, please don't hesitate to let me know. Your satisfaction is our priority, and we'll do our best to ensure a seamless ordering experience."
BIZ,can you help me to cancel order {{Order Number}} ?,ORDER,cancel_order,"Of course, I'm here to help you with canceling your order associated with the purchase number {{Order Number}}. I understand that circumstances may have changed, and you no longer wish to proceed with this purchase. Let's resolve this for you as quickly as possible. 

To cancel your order, please follow these steps:
1. Sign in to your {{Online Company Portal Info}}.
2. Locate the '{{Online Order Interaction}}' or '{{Online Order Interaction}}' section.
3. Find the order with the purchase number {{Order Number}} and click on it.
4. Look for the option labeled '{{Online Order Interaction}}' and click on it to initiate the cancellation process.
5. Follow any additional prompts or questions to complete the cancellation.

If you encounter any difficulties along the way or have any questions, our dedicated team is available during {{Customer Support Hours}}. You can reach us at {{Customer Support Phone Number}} or through the Live Chat feature on our {{Website URL}}. We value your satisfaction and are committed to assisting you throughout the cancellation process."
BLMQZ,i want help to swap several articles of order113542617735902,ORDER,change_order,"I can relate to the understanding that you need assistance with swapping several articles in your order with number {{Order Number}}. We're here to help make sure your order is exactly what you want it to be. Could you please provide the specific articles you would like to swap out, as well as the items you would like to replace them with? This way, we can ensure a smooth and seamless process for you. Thank you for your cooperation and patience while we work on resolving your request."
BEM,I do not know what I need to do to buy some items,ORDER,place_order,"Thanks for getting in touch! I grasp that you may be unfamiliar with the process of buying our items, and I'm here to guide you through it. To begin with, let's break down the steps you need to take to make a purchase:

1. Browse our online catalog: Visit our website and explore the wide range of items we offer. You can filter your search based on categories, prices, or any specific requirements you may have.

2. Select your desired items: Once you've found the items you wish to purchase, click on them to view the detailed product information, such as specifications, features, and pricing. Take your time to read and compare, ensuring you make an informed decision.

3. Add items to your cart: When you've made your selection, click the ""Add to Cart"" button to place the items in your virtual shopping cart. You can continue browsing for more items or proceed to the next step.

4. Review your cart: Go to your shopping cart and make sure all the items you intend to purchase are listed correctly. You can adjust the quantities or remove any unwanted items at this stage.

5. Proceed to checkout: Once you're satisfied with the items in your cart, click the ""Checkout"" button to proceed. You may be required to create an account, provide your contact and shipping information, and select your preferred payment method.

6. Complete the payment: Follow the instructions to securely complete the payment process. We accept various payment options, such as credit cards, PayPal, or bank transfers. You'll receive confirmation of your payment once it's successfully processed.

7. Track your order: After your purchase is confirmed, you'll receive an order confirmation email with all the details. You can track the status of your order through your account on our website or contact our customer support team for any assistance.

That's it! These steps should help you navigate the process of buying our items. If you have any further questions or need assistance at any point, please don't hesitate to reach out to me. Happy shopping!"
BCL,"I have to see order {{Order Number}} current status, I need help",ORDER,track_order,"Thank you for reaching out! I completely understand that you need assistance in checking the current status of your order with the order number {{Order Number}}. I'm here to help you with that. To view the current status of your order, please visit the ""Order History"" section on our website. If you have any further questions or need additional guidance, feel free to ask. I'm dedicated to ensuring that you have a smooth and seamless experience."
BL,I need help seeing the ETA of the purchase {{Order Number}},ORDER,track_order,"Thank you for reaching out! I'm here to assist you in finding the estimated time of arrival (ETA) for your purchase with the purchase number {{Order Number}}. To check the ETA, you can visit the '{{Order Number}}' section on our website or contact our customer support team through {{Customer Support Phone Number}} or Live Chat on our website at {{Website URL}}. They will be happy to provide you with the updated ETA and any other assistance you may need. Feel free to let me know if there's anything else I can help you with!"
BELNQ,i cannot check purchase {{Order Number}} status,ORDER,track_order,"I'm sorry to hear that you're having trouble checking the status of purchase {{Order Number}}. I'm here to assist you with that. In order to better understand the issue, could you please provide me with some more information? Specifically, let me know which platform or website you are using to track your purchase. This will help me provide you with more accurate guidance on how to resolve the issue. Thank you for your patience, and I look forward to assisting you further!"
BL,see order {{Order Number}} current status,ORDER,track_order,"Honored to assist! I'm clued in that you would like to know the current status of your order with the order number {{Order Number}}. To provide you with the most accurate information, I kindly request you to provide me with a few moments while I check the status of your order. Once I have the details, I will promptly assist you with the current status. Thank you for your patience!"
BQ,i try to cancel order {{Order Number}},ORDER,cancel_order,"I grasp your desire to cancel your purchase with order number {{Order Number}}, and I'm here to assist you with this process. To cancel your order, please follow these steps:

1. Sign in to Your Account: Access our platform by logging into your {{Online Company Portal Info}}.
2. Locate Your Order: Navigate to the '{{Online Order Interaction}}' or '{{Online Order Interaction}}' section.
3. Find the Purchase: Look for the order number {{Order Number}} and click on it.
4. Initiate the Cancellation: You should see an option labeled '{{Online Order Interaction}}' associated with your purchase. Please select this option.
5. Confirm the Cancellation: The system may prompt you to confirm the cancellation. Please follow the instructions provided to complete the process successfully.

Should you encounter any issues or have further questions, our dedicated support team is available during {{Customer Support Hours}} at {{Customer Support Phone Number}} or through the Live Chat feature on our {{Website URL}}. We truly value your satisfaction and are committed to making this cancellation process as smooth as possible."
BLQ,need assistance to see the eta of purchase {{Order Number}},ORDER,track_order,"We're all ears! I'm tuned into the idea that you need assistance to check the Estimated Time of Arrival (ETA) for your purchase with the purchase number {{Order Number}}. To provide you with the most accurate information, could you please provide me with your order details such as the name under which the purchase was made or any other relevant information? This will help me locate the specific purchase and provide you with the ETA."
BILPQ,how could i check the ETA of the order {{Order Number}},ORDER,track_order,"We're all ears! I'm tuned into the idea that you would like to know how to check the estimated time of arrival (ETA) for your order with the number {{Order Number}}. To do so, I recommend visiting the '{{Order Tracking}}' section on our website. There, you can enter your order number and get real-time updates on the status and ETA of your order. If you need further assistance or have any other questions, feel free to ask. I'm here to help you every step of the way!"
BK,cancel order {{Order Number}},ORDER,cancel_order,"I've come to understand that you're seeking assistance with canceling your order associated with the purchase number {{Order Number}}. Rest assured, I'm here to help you with that. To cancel your order, please follow these steps:

1. Log into your account on our {{Online Company Portal Info}}.
2. Navigate to the '{{Online Order Interaction}}' or '{{Online Order Interaction}}' section.
3. Look for the purchase with the order number {{Order Number}} and click on it to view the details.
4. Within the order details, you should see an option to '{{Online Order Interaction}}'. Please select this option.
5. Follow any additional steps or prompts provided by the system to complete the cancellation process.

If you encounter any difficulties or have further questions, our dedicated support team is available during {{Customer Support Hours}} at {{Customer Support Phone Number}}. You can also reach out to us through the Live Chat feature on our {{Website URL}}. Your satisfaction is our top priority, and we're here to ensure a smooth cancellation experience for you."
B,I need help to cancel order {{Order Number}},ORDER,cancel_order,"I pick up what you're putting down that you require assistance with canceling your order having the order number {{Order Number}}. Rest assured, I'm here to guide you through the process. Here's what you need to do:

1. Sign in to Your Account: Begin by logging in to our {{Online Company Portal Info}} using your credentials.
2. Visit Your Orders: Once you're logged in, navigate to the '{{Online Order Interaction}}' or '{{Online Order Interaction}}' section.
3. Identify the Specific Order: Look for the order with the number {{Order Number}} in the list and click on it.
4. Initiate the Cancellation: On the order details page, you should find an option labeled '{{Online Order Interaction}}'. Please select this option to start the cancellation process.
5. Follow Any Additional Instructions: Depending on our system, you may need to provide further details or answer some questions. Kindly follow the instructions and provide the necessary information as prompted.

If you encounter any difficulties during the cancellation process or have any questions, please don't hesitate to reach out to our dedicated support team. They are available during {{Customer Support Hours}} at {{Customer Support Phone Number}} or through the Live Chat on our website at {{Website URL}}. Your satisfaction is our utmost priority, and we're committed to serving you in the best possible way."
BCL,"I want to order a product, I need help",ORDER,place_order,"Thank you for getting in touch to us for assistance with placing an order. We are here to guide you through the process and ensure a smooth and satisfying experience. To get started, please let us know the specific product you would like to order and any other details or questions you may have. We're here to help and make sure you get exactly what you need."
BLQ,need to see purchase {{Order Number}} status,ORDER,track_order,"Your message means a lot! I'm aligned with the idea that you need to see the status of your purchase with purchase number {{Order Number}}. To check the current status, please visit the '{{Purchase History}}' section on our website. If you have any other questions or require further assistance, please feel free to ask. I'm here to help you every step of the way!"
BEN,I cannot change order {{Order Number}},ORDER,change_order,I've ascertained that you are unable to change the order with the number {{Order Number}}. I apologize for any inconvenience this may have caused you. Our team is here to help you find a solution. Can you please provide me with more details about the issue you are facing? This will allow us to better assist you and provide alternatives or explain the process further.
BK,checking order {{Order Number}} status,ORDER,track_order,"Glad you contacted us! I'm clearly cognizant that you would like to check the status of your order with the order number {{Order Number}}. To provide you with accurate information about your order, could you please share your full name and email address associated with the order? We take privacy and security seriously, and we want to ensure that we are accessing the correct order details for you. Once you have provided this information, I will be able to assist you further in tracking the status of your order."
BLW,I have got to delete a damn product from purchase {{Order Number}},ORDER,change_order,"I fathom that you need assistance in deleting a specific product from purchase number {{Order Number}}. I apologize for any inconvenience caused and assure you that I'm here to help you resolve this issue. To proceed with the deletion, could you please provide me with the details of the product you wish to remove? This will allow us to take the necessary steps and ensure your purchase is exactly as you desire. Thank you for your cooperation in helping us improve our services."
BIL,can I see the ETA of the purchase {{Order Number}}?,ORDER,track_order,"Sure! I'm here to assist you with checking the estimated time of arrival (ETA) for your purchase with purchase number {{Order Number}}. To provide you with the most accurate information, could you please provide me with some additional details such as your name or order number? This will help me locate the specific purchase in our system and give you the precise ETA. Thank you!"
BI,what do I need to do to cancel order {{Order Number}}?,ORDER,cancel_order,"I've realized that you're seeking guidance on canceling your order with the order number {{Order Number}}. 

To initiate the cancellation process, please follow these steps:

1. Access Your Account: Begin by logging into your {{Online Company Portal Info}} using your registered credentials.
2. Locate Your Order: Once logged in, navigate to the '{{Online Order Interaction}}' or '{{Online Order Interaction}}' section, where you can view your past purchases.
3. Select the Order: Identify the specific purchase linked to the order number {{Order Number}} and click on it to access the order details.
4. Initiate Cancellation: Within the order details, you will find an option labeled '{{Online Order Interaction}}'. Please select this option to proceed with the cancellation.
5. Confirm the Cancellation: The system may prompt you for confirmation or additional information to process the cancellation. Please provide the necessary details as required.

If you encounter any challenges during the cancellation process or have any further questions, our dedicated team is available to assist you. Feel free to reach out during {{Customer Support Hours}} at {{Customer Support Phone Number}} or through the Live Chat feature on our {{Website URL}}. We are here to ensure your satisfaction every step of the way."
BILMQ,what do i have to do to earn several of ur item,ORDER,place_order,"Thank you for your interest in earning several of our items! To get started, you can follow these steps:

1. Browse our selection: Take some time to explore our wide range of products to find the ones you're interested in earning.

2. Create an account: If you haven't already, sign up on our website or app to create an account. This will allow you to track your progress and receive updates.

3. Earn points: Participate in our loyalty program or promotions to earn points or rewards that can be redeemed for the items you want. Keep an eye out for special offers and activities to maximize your earning potential.

4. Check your balance: Regularly check your points balance to see how close you are to reaching your goal. You can usually find this information in your account settings or loyalty program details.

5. Redeem your points: Once you have accumulated enough points, visit the redemption section on our website or app. Choose the items you want to redeem and follow the instructions to complete the redemption process.

If you have any specific questions or need assistance along the way, don't hesitate to reach out to our customer support team. We're here to help you make the most of your earning journey. Happy earning!"
BILM,can you help me order a few of your product?,ORDER,place_order,"Thank you for your interest in our products! I would be more than happy to assist you in placing an order for a few of our items. To get started, please let me know which specific product(s) you would like to order, and I will guide you through the process step by step. Your satisfaction is our top priority, and I am here to ensure that you have a smooth and enjoyable ordering experience."
BZ,I need assistajce to remove something from order {{Order Number}},ORDER,change_order,"We understand that you require assistance in removing an item from order number #{{Order Number}}. We apologize for any inconvenience caused. To ensure we provide you with accurate guidance, could you please specify which item you would like to remove from your order? Your satisfaction is our top priority, and we are here to help make this process as smooth as possible for you."
BIL,what do I have to do to see the status of purchase {{Order Number}}?,ORDER,track_order,"We appreciate your message! It's clear to me that you would like to know what steps to take in order to view the status of your purchase with the order number {{Order Number}}. To check the status of your purchase, you can visit our website and navigate to the ""Order History"" section. Once you're on the ""Order History"" page, you should be able to find the specific purchase by searching or filtering by the order number. By selecting the purchase, you will be able to view the current status, estimated time of arrival (ETA), and other relevant details. If you encounter any difficulties or require further assistance during this process, please don't hesitate to let me know. I'm here to guide you and ensure a seamless experience."
BL,I try to check the ETA of the purchase {{Order Number}},ORDER,track_order,"We're all ears! I'm tuned into the idea that you are trying to check the estimated time of arrival (ETA) for your purchase with the purchase number {{Order Number}}. To provide you with accurate information about your order, may I kindly ask you to provide me with the correct purchase number or order number? With the correct details, I'll be able to assist you in a more precise manner."
