question,category,document
"For corrections in my initial buying action with identifier number {{Order Number}}, could you guide me on how to proceed?",ORDER,a07d0050
Which products do I purchase?,ORDER,15120916
How to make a order for more than one item?,ORDER,15120916
Can you guide me in buying several items from your store quickly and smoothly?,ORDER,15120916
What is the first step in ordering multiple products today?,ORDER,15120916
Please help with placing an order involving numerous goods.,ORDER,15120916
can uhelp delete item from purchase {{Order Number}}?,ORDER,80ae36b8
how to remove something I bought erroneously in order #{{Order Number}}?,ORDER,80ae36b8
How to delete an article from my order?,ORDER,f382b660
Can you assist in removing a specific item from the past purchase under Order Number {{Order Number}}?,ORDER,f382b660
I need help with deleting something I ordered; what details do you require from me?,ORDER,f382b660
What's my ETA for delivery? Order #{{Order Number}},ORDER,496b0b95
How soon will the purchase {{Order Number}} arrive?,ORDER,496b0b95
Can you update me on shipping estimates for order number. Help needed.,ORDER,496b0b95
When can I expect to receive package nbr {{Order Number}} using status inquiry tool?,ORDER,496b0b95
"May I get current tracking info or ETA for my recent transaction, identification provided.",ORDER,496b0b95
How do I earn a product?,ORDER,7df14ab4
What steps are involved to accumulate rewards?,ORDER,7df14ab4
'Provide guidance on the reward program.',ORDER,7df14ab4
Can you explain how friends referrals work for earned items?,ORDER,7df14ab4
I'm interested in buying a few items.,ORDER,f437597f
How do I go about purchasing multiple products?,ORDER,f437597f
Could you assist me with ordering several goods from your store?,ORDER,f437597f
What details are needed for placing orders of more than one product?,ORDER,f437597f
Can help be provided to order several things at once?,ORDER,f437597f
Can I swap an item from order {{Order Number}}?,ORDER,b1bdc2f2
Please provide details about the swapping item and desired replacement.,ORDER,b1bdc2f2
Is there a specific timeframe for processing such requests?,ORDER,b1bdc2f2
How would changes to my order affect delivery dates if any items are perishable or seasonal?,ORDER,b1bdc2f2
"What is your refund policy, in case I'm not satisfied with the swapped item?",ORDER,b1bdc2f2
I want help making several acquisitions.,ORDER,35440a0f
How do I earn multiple pieces of content?,ORDER,35440a0f
Can you guide me through obtaining more articles at once?,ORDER,35440a0f
What process should I follow to get many papers or reports quickly and efficiently?,ORDER,35440a0f
My order needs correction how do I proceed?,ORDER,e3d8d3c8
What specific changes can be made to my past order for correction details needed?,ORDER,e3d8d3c8
Please clarify the type of adjustments desired as customer support aids.,ORDER,e3d8d3c8
"Is it possible to modify an outdated or mistakenly placed online purchase, and what are required actions from my side?",ORDER,e3d8d3c8
I realized I have wrong item; can you help me in exchanging back for correct one?,ORDER,e3d8d3c8
I need help to change my order number... what do I have?,ORDER,a4835a67
"Amending changes for the order, what next steps are required of me and in which format should they be presented by you.",ORDER,a4835a67
How can I effectively communicate a complete overhaul on item(s) inside my purchase batch without affecting others who received it successfully already (the request will not impact any other items or orders).,ORDER,a4835a67
"If changes to the order need more details, how do provide these specific modifications including possible restock necessities?",ORDER,a4835a67
What are your processes and limitations on alterations in a completed purchase transaction?,ORDER,a4835a67
How can I add multiple items to Order Number {{Order Number}} on your website?,ORDER,97a7febf
"I'm confused about how to edit my purchase and include additional products with the order number given. Can you help guide me through this process, please?",ORDER,97a7febf
Where do I start when buying your product?,ORDER,7312ee12
Can you help me acquire a specific item from your catalogue?,ORDER,7312ee12
May you guide me through the process of ordering something from your store for purchase?,ORDER,7312ee12
Please tell us how to get hold of one of your available products.,ORDER,7312ee12
I am not sure about which product I should buy; could we discuss our selections?,ORDER,7312ee12
I found my order number how do I cancel it?,ORDER,e5b4fa73
What steps must I take to request an order cancellation on your site?,ORDER,e5b4fa73
"Could you guide me through the online process for canceling a past order with reference to its quantity/number, just in case?",ORDER,e5b4fa73
Is there anything specific that might require my attention or confirmation during this order cancellation procedure?,ORDER,e5b4fa73
Where and how do I reach out if questions arise while dealing with an order's removal?,ORDER,e5b4fa73
How do I cancel my order with Order Number {{Order Number}}?,ORDER,19a5f0fb
Can you guide me through the cancellation process for purchase {{Order Number}} on your website during Customer Support Hours?,ORDER,19a5f0fb
Where in my account should I click to see and initiate the cancellation of Purchase ID {{Order Number}} online?,ORDER,19a5f0fb
What do I need to confirm before completing the order cancellation after finding it as Order Number {{Order Number}} on your portal?,ORDER,19a5f0fb
Does our customer service provide live support if I encounter issues while trying to cancel my purchase with Order Number {{Order Number}}?,ORDER,19a5f0fb
How can I add products to my existing order #{{Order Number}}?,ORDER,c0a7766f
What are the steps to update an already placed order with additional items by clicking 'Add Items' on our website for Order number {{Order Number}}?,ORDER,c0a7766f
"If there is a difficulty in adding more than one item at once, and specific products aren't appearing as selectable options under my current selections—are these issues common or are they likely caused by technical glitches within the system after an update to order #{{Order Number}}, requiring immediate resolution?",ORDER,c0a7766f
"What customer support channels can I access immediately for guidance on expanding items in my selected Order number {{Order Number}} if unforeseeable complications arise while using the 'Add Items' option, and how do these differ from regular assistance processes?",ORDER,c0a7766f
How to order multiple items?,ORDER,c32e3944
Please guide me through placing several orders online.,ORDER,c32e3944
What is the procedure for ordering more than one product on your site?,ORDER,c32e3944
"I'm interested in buying several things, how does that work here?",ORDER,c32e3944
Can you help with a bulk order and if so what are steps?,ORDER,c32e3944
I need help canceling my order number {{Order Number}}.,ORDER,43dee88b
Can you provide me the steps to initiate cancellation of an online purchase?,ORDER,43dee88b
What credential information do I require for signing into account via customer portal access?,ORDER,43dee88b
How should I locate and select a specific past purchase in 'Online Order Interaction' section?,ORDER,43dee88b
"Who can assist if further difficulties arise after attempting order cancelation, when?",ORDER,43dee88b
What specific problems occurred during item swapping?,ORDER,95e9fa2c
How do I provide details of my issues swiftly for resolution?,ORDER,95e9fa2c
Is there a standard procedure to follow while facing difficulties with order modifications?,ORDER,95e9fa2c
Can someone assist immediately in sorting out the swap troubles without unnecessary hassle?,ORDER,95e9fa2c
Was prompt feedback and assistance during these times common before?,ORDER,95e9fa2c
What's the easiest way to check my purchase order status?,ORDER,0fa7d568
How can I see where an order with a specific number is currently at on your site?,ORDER,0fa7d568
"Can someone guide me through monitoring the progress of our transaction, please?",ORDER,0fa7d568
How do I track my purchase order number?,ORDER,009680e8
Where can I find the status of my recent online shop?,ORDER,009680e8
What steps are involved in tracking to delivery date after ordering?,ORDER,009680e8
"If something goes wrong while trying to check on my package, whom should I contact for aid?",ORDER,009680e8
Does your website automatically update order information or is manual checking necessary?,ORDER,009680e8
Can I remove an item from my order? What steps should I follow after contacting customer support to delete something specific from order {{Order Number}}?,ORDER,fd9af0a4
I need help deleting a product from the finalized purchase of order number {{Order Number}}. Did you provide any guidance on this matter via your FAQs or does it require direct interaction with someone here for resolution?,ORDER,fd9af0a4
How do I order several articles?,ORDER,f9b4d972
What details are needed for the place_order intent?,ORDER,f9b4d972
... (additional questions related to steps or information required) ...,ORDER,f9b4d972
How do I cancel my purchase?,ORDER,399b4cf1
What are the steps to request a cancellation for order {{Order Number}}?,ORDER,399b4cf1
Can you guide me through how to initiate an online item sale cancellation in your system?,ORDER,399b4cf1
"Where should I find and select the cancellation option for buy order number {{Order Number}} on my account page, please?",ORDER,399b4cf1
What is one thing that our customer support team needs from customers after providing help?,ORDER,399b4cf1
Can you help me change items from order #{{Order Number}}?,ORDER,2466b461
"[Name], I would like my prior request updated. Please remove {{Item to alter}}, make sure the correct item is included.",ORDER,2466b461
"How can we go through with modifying this particular component, {{Component of Order}}, in relation to number {{Order Number}})?",ORDER,2466b461
To find my order with number {{Order Number}}? Need email/name for help.,ORDER,12434989
How can I get support to check the purchase status of Order No. {{Order Number}}?,ORDER,12434989
"Tracking how's it at what point on delivery date using order #{{Order Number}} info? Suggestions, please!",ORDER,12434989
Can you look up my Order #{{Order Number}} and tell its current place or expected arrival time for me right now?? Stress.,ORDER,12434989
Getting assistance locate purchase associated with identifier {{Order Number}})?,ORDER,12434989
I need help finding an item on your site.,ORDER,8306b331
Can you guide me through the ordering process?,ORDER,8306b331
What details do I need to provide for placing my order?,ORDER,8306b331
How can customer support assist with special requests or questions during checkout?,ORDER,8306b331
Are there any promotions available that could apply to my purchase?,ORDER,8306b331
What's my order status? I want info on {{Order Number}}.,ORDER,7328324c
Can you check the current location of #{{Order Number}} ordered items please?,ORDER,7328324c
"I need to find out where are item(s) with ID# and Order number from FAQ positioned right now, can assist?",ORDER,7328324c
Show me any recent updates available for my Item purchase or shipment. How about order status tracking of #{{Order Number}}.,ORDER,7328324c
FAQ mentions 'current order progress' but I need specific details linked to {{Order Number}}. What are those?,ORDER,7328324c
How do I cancel my order with number {{Order Number}}?,ORDER,74714b1b
What steps are involved in cancelling an online purchase identified by the given Order ID?,ORDER,74714b1b
"Can you guide me through the process to ensure my recent purchase gets cancelled as planned, including where exactly on your site I should go and what options available afterward?",ORDER,74714b1b
"After selecting 'cancel' for a specific item from order {{Order Number}}, am I just done with that or might there be additional confirmation steps required post-cancellation request initiation?",ORDER,74714b1b
How can I see my order’s arrival time?,ORDER,2649147b
Why isn't ETA displayed for my purchase with Order Number {{Order Number}}?,ORDER,2649147b
What steps do I need to follow to check the delivery date of my item bought under Purchase Number {{Order Number}}?,ORDER,2649147b
"Where can I find out when my package will arrive given its shipping number, specifically for order with ID |{{Order Number}}| and platform/web URL used?",ORDER,2649147b
How may extra actions do I need to take besides Order Number {{Order Number}})to obtain the ETA?,ORDER,2649147b
What login credentials do I use for signing into my {{Online Company Portal Info}}?,ORDER,5bb7350a
Where can I find '{{Online Order Interaction}}' options in the purchase records section of your online portals?,ORDER,5bb7350a
"Should I initiate a live chat instead, and where exactly is that option located on the website at {{Website URL}}?",ORDER,5bb7350a
Could you provide me with more details about what information might prompt after confirming my cancellation attempt?,ORDER,5bb7350a
What are your customer support hours within which it's recommended to reach out for further help?,ORDER,5bb7350a
How can I view my order ETA?,ORDER,3d19ae4f
Can you help me find out when the package will arrive with its number {{Order Number}}?,ORDER,3d19ae4f
What steps do I need to follow to check on ship status using my Order Number {{Order Number}}'s ETA?,ORDER,3d19ae4f
"Is it possible for your team to provide update about arrival date and time of order through phone or website, if missing info in email by means of tracking with specific number {{Order Number}}?",ORDER,3d19ae4f
Just wondering how I can track the expected delivery estimate - is accessing via a link provided on our site sufficient using my personalized Order Tracking page for given item's reference?,ORDER,3d19ae4f
How can I start purchasing our products?,ORDER,4aeea02d
What do I need to add items in my cart?,ORDER,4aeea02d
Where and how can I get help if needed?,ORDER,4aeea02d
When is the customer support available via live chat or phone?,ORDER,4aeea02d
Are there any specific steps for beginning a purchase on your website?,ORDER,4aeea02d
Can you tell me when my package will arrive? I need to know for {{Order Number}}.,ORDER,356af95d
I'm looking for the estimated date of arrival (ETA) on order number {{Order Number}}. Could someone help with that?,ORDER,356af95d
"When is ETA expected around for shipment #{{Order Number}}? My customer tracking info wasn't necessary this time, but I want to know. If you need more details later.",ORDER,356af95d
Hi! It seems my items are on track and in transit via {{Delivery Option}}. Could someone provide the delivery ETA based on shipping address or if a tracking number is needed?,ORDER,356af95d
I noticed that package #{{Order Number}} hasn't arrived yet. For what estimated time am I supposed to get it delivered?,ORDER,356af95d
How can I cancel my purchase with Order Number {{Order Number}}?,ORDER,73f47bfd
What is the procedure for assisting me in canceling a specific order using its number?,ORDER,73f47bfd
Could you provide guidance on initiating the online cancellation process through the portal for an identified purchase by number?,ORDER,73f47bfd
"During step 3, if I encounter any challenges finding or clicking my Order Number's details to proceed with termination of the sale via web interaction toolkit, what should I do? And similarly in steps where manual confirmations are required; guidance needed on how best undertake these actions. Please note that further clarification will be sought during service hours as provided.",ORDER,73f47bfd
"Can you inform me about any potential deductions or company rules regarding the refund/cancellation of my purchase, along with understanding the process and contact channels for such inquiries?",ORDER,73f47bfd
How do I switch several items for Order Number?,ORDER,3226eec5
Can item changes be done and who assists with it in my order No.,ORDER,3226eec5
"Provide assistance requesting to change a few bought products, which was previously ordered as ",ORDER,3226eec5
Direct contact details needed where customer is required to inform team about wish to switch purchased items for an existing order number,ORDER,3226eec5
Available hours and contacts info necessary?,ORDER,3226eec5
Which specific articles do I need to change?,ORDER,04aa7a17
How soon can changes be applied and reflected in my order status?,ORDER,04aa7a17
Is there an estimate of additional costs or fees for changing the articles on purchase {{Order Number}}?,ORDER,04aa7a17
"Once changed, does everything else remain as it was originally ordered besides these specific items?",ORDER,04aa7a17
Which platform/website did I use to buy this product?,ORDER,7a10a51d
", and is the order status visible anywhere on your end? The ETA should be listed there.",ORDER,7a10a51d
. Can you elaborate more on why accessing my purchase's estimated time of arrival seems challenging at present? Your details will help expedite resolving the issue faster.,ORDER,7a10a51d
"What steps can I take to view or get real-time updates about my order, based on usual best practices that might differ by platform/website types?",ORDER,7a10a51d
Can I change my order with that number?,ORDER,24ec78d3
Specific changes needed for Order Number {{Order Number}} please elaborate.,ORDER,24ec78d3
What details do you require to accommodate the requested changes efficiently?,ORDER,24ec78d3
"How will this correction affect my delivery timeframe and charges, if applicable?",ORDER,24ec78d3
Is there a possibility of expedited service considering these modifications?,ORDER,24ec78d3
I need assistance with ordering some of your articles.,ORDER,082d6d87
Which specific items am I allowed to order?,ORDER,082d6d87
Can you walk me through the ordering process now?,ORDER,082d6d87
What do I have to provide for my purchase request currently?,ORDER,082d6d87
How do I purchase items?,ORDER,144f8195
What is the procedure for buying products from you?,ORDER,144f8195
Can someone guide me through purchasing on your website/app?,ORDER,144f8195
Could you elaborate on how to complete a buy online transaction with us?,ORDER,144f8195
Is there assistance available if I'm unsure about placing an order?,ORDER,144f8195
I need to cancel my purchase with Order Number {{Order Number}}; how do I proceed?,ORDER,d183b545
"Can you tell me the steps for cancelling a transaction using {{Online Company Portal Info}} and {{Online Order Interaction}} section, starting from signing in?",ORDER,d183b545
What exactly should I click on within my account to initiate the purchase number {{Order Number}}'s online order interaction?,ORDER,d183b545
"After finding an option related to cancelling my Online Transaction for Purchase no. {{Order Number}}, what are the next immediate actions required during its execution?",ORDER,d183b545
Could you help cancel my order with the provided Order Number? How do I begin this process?,ORDER,e0baa54e
"Once logged in to your account on {{Online Company Portal Info}}, how can I find and select 'cancel_order' interaction for my specific purchase marked by {{Order Number}}?",ORDER,e0baa54e
"What is included in step 5 of the cancellation procedure, where it asks me if I want to cancel now or later?",ORDER,e0baa54e
Could help with buying some articles? Detail needed.,ORDER,3a8487fa
What's process for purchase initiation? Assistance sought.,ORDER,3a8487fa
Article suggestions desired: Help requested based on interests?,ORDER,3a8487fa
"Wish recommendations to guide article choice, please offer aid in selecting best fits according to given criteria or preferences (if provided). Want a personalized shopping experience tailored towards my needs with minimal hassle transaction.",ORDER,3a8487fa
How can payment and order confirmation be completed after selection of desired articles? Inquiring about finalizing purchase process post-selection.,ORDER,3a8487fa
I need help buying it.,ORDER,1ea876d1
Can you tell me how to buy?,ORDER,1ea876d1
Assist with purchasing process please.,ORDER,1ea876d1
How do I order the article?,ORDER,1ea876d1
"Step by step, can guide through purchase?",ORDER,1ea876d1
how can I confirm my {{Order Number}} status with ease?,ORDER,de11098c
"what's the quickest way to find where in is our purchase?,",ORDER,de11098c
can you guide me through using this 'Online Order Interaction' thingy on your site without a headache.,ORDER,de11098c
"if website navigation proves troublesome, what alternative options do I have for status checks?",ORDER,de11098c
what kind of support can I expect if further help is required?,ORDER,de11098c
How do I cancel my order?,ORDER,9109df11
What steps should I follow to easily cancel an order on the portal given its number?,ORDER,9109df11
"Can you guide me through the cancellation process of a specific online order, and is live chat assistance available if needed?",ORDER,9109df11
Do I need customer support contact details for further issues with my account or orders besides web interactions?,ORDER,9109df11
What are your operating hours to ensure timely resolution when interacting via phone?,ORDER,9109df11
I can no longer afford order {{Order_Number}}.,ORDER,53f8ec01
What options are available due to my change in financials regarding {{Order Number}}?,ORDER,53f8ec01
Is there a review of the Order Details I could do for potential budget-friendly modifications?,ORDER,53f8ec01
"Could you provide me with ways to get assistance from customer support during their business hours, maybe by phone or live chat at website URL and how it can help reschedule my order, discuss payment options?",ORDER,53f8ec01
I want ETA for my {{Order Number}} purchase.,ORDER,6d6ec3cd
How to look up the estimated arrival (ETA) of order number {{Order Number}}?,ORDER,6d6ec3cd
Can you update me on when I will receive a package with Order Number {{Order Number}}?,ORDER,6d6ec3cd
What is the current status and ETA for my delivery marked by Order Number {{Order Number}}?,ORDER,6d6ec3cd
Please let me know if there's an updated timeline for expected arrival of Package ID matching Order Number {{Order Number}}.,ORDER,6d6ec3cd
How do I find my purchase {{Order Number}}?,ORDER,70165a9b
I need help locating where's my order numbered as '{{Order Number'}}. Can you guide?,ORDER,70165a9b
What steps should I take to locate a specific purchase recorded with the Order Number:{{Order Number}}?,ORDER,70165a9b
"Is there a way for me, using {Product or Service} and Order Number {{Order Number}}, find my order in your system?",ORDER,70165a9b
How do I cancel my order?,ORDER,83cbc9c2
What should I click after locating my specific order number on the website?,ORDER,83cbc9c2
"Is there a confirmation stage in cancelling an online purchase, and what is it for?",ORDER,83cbc9c2
"In case of difficulties during this process or additional queries about cancellation, whom do I contact?",ORDER,83cbc9c2
What are the available methods to reach customer support when dealing with order issues?,ORDER,83cbc9c2
I want to buy multiple products; how do I proceed?,ORDER,adf06b5f
Can you walk me through buying several articles online?,ORDER,adf06b5f
Is there a guide on purchasing various items as one order?,ORDER,adf06b5f
How can I acquire numerous things in bulk form using your service?,ORDER,adf06b5f
What's the best way to order multiple products efficiently?,ORDER,adf06b5f
How can I cancel my order?,ORDER,b23b491e
What do I need to access my account for the Order Cancellation process?,ORDER,b23b491e
"Where in my online portal should I find my completed purchase history including the given order number, and next action option?",ORDER,b23b491e
Assuming an on-screen request for confirmation arises during cancellation; what specific affirmative actions am I required to take within this phase of Order Cancellation?,ORDER,b23b491e
Can I remove an item from my purchase?,ORDER,fff3365e
How do I return something I bought in order number {{Order Number}}?,ORDER,fff3365e
Which steps should I follow to alter the items of my purchased merchandise with reference code {{Order Number}}?,ORDER,fff3365e
Is it possible for me to get an item refund or exchange after confirming removal from my account under purchase ID ({{Order Number}})?,ORDER,fff3365e
Please assist in reversing a part transaction identified by Order number {{Order Number}}. I need guidance.,ORDER,fff3365e
I want to check my order status with a specific number.,ORDER,0397fccc
How can I see the details of an existing purchase?,ORDER,0397fccc
Can you help me find where to look for tracking information on your site?,ORDER,0397fccc
"Is there another way, besides calling support, to get updates about my package delivery?",ORDER,0397fccc
What step do I take next if I'm unsure when 'Online Order Interaction' will show order status?,ORDER,0397fccc
How to find my order status?,ORDER,aabdee31
Where can I see the shipping details for my {{Order Number}} order on your website?,ORDER,aabdee31
"I'm unable to locate where you stand with the package tagged as Order number {{Order Number}}, need help.",ORDER,aabdee31
Can someone assist me in tracking down the progress of packet marked Orders Number {{Order Number}} via our web site?,ORDER,aabdee31
"What should I check if not able to find shipment status for my order, identified by Order Number {{Order Number}}?",ORDER,aabdee31
What specific products am I interested in earning?,ORDER,885bd294
Can you assist me through the process of gaining several items or services on your platform?,ORDER,885bd294
How can I efficiently achieve my goal using minimal steps from this chat?,ORDER,885bd294
Can I remove some articles from my purchase order {{Order Number}}?,ORDER,88c38604
What specific difficulties am I facing in removing items from the purchase number {{Order Number}}?,ORDER,88c38604
Did I signify anything wrong when trying to modify this order with reference {{Order Number}}?,ORDER,88c38604
