question,category,document
I want to find the perfect items. Can assist.,ORDER,ec88cbc5
Details help understand needs?,ORDER,ec88cbc5
Explore products matching interest.,ORDER,ec88cbc5
How do I place an order for multiple articles?,ORDER,09c7660f
I want to purchase several of your items; what steps should I follow on the website?,ORDER,09c7660f
Can you guide me through adding products to my cart and checking out online?,ORDER,09c7660f
What information is needed during checkout when placing an item in a shopping cart?,ORDER,09c7660f
Are there any special help options if I run into issues with ordering multiple items?,ORDER,09c7660f
How can I see my order status?,ORDER,f3b366cd
Where do report purchase tracking on site?,ORDER,f3b366cd
What info does the 'Order Status' section provide concerning a buy?,ORDER,f3b366cd
I forgot my login and had trouble seeing where an order stands.,ORDER,f3b366cd
"If there are issues accessing my order details, how can I resolve this?",ORDER,f3b366cd
I need to cancel my recent purchase with order {{Order Number}}. Which step should I follow first?,ORDER,5e802350
"Where on your account can 'order {{Online Order Interaction}}' options be found after login, specifically for an issue like mine related to the difficulty in using this feature regarding ordering number {{Order Number}}?",ORDER,5e802350
"Does navigating directly to my purchase with order number {{Order Number}} streamlines or complicates the process of cancellation considering your response directions aiming towards resolution due to difficulties experienced by me, and do I need any consent forms related to changes in account details before proceeding based on this guidance given for seamlessness?",ORDER,5e802350
Considering my request needs a human touch since earlier automated processes weren't sufficient according to your records—were there additional resources such as email assistance or live support available that could give me direct intervention while using the steps outlined related to handling issues encountered in cancelling purchase number {{Order Number}}?,ORDER,5e802350
Which product from purchase #{{Order Number}} should be removed?,ORDER,a4f3edc7
Please clarify the specific item to delete.,ORDER,a4f3edc7
I want a confirmation for deleting an item—what details do you need?,ORDER,a4f3edc7
"For which order can I initiate this deletion process, reference number or other ID in hand?",ORDER,a4f3edc7
"To ensure proper execution of request, exactly whose product am I removing?",ORDER,a4f3edc7
How do I cancel {{Order Number}}?,ORDER,8065c6fc
What are the steps to cancel my order with number {{Order Number}} at {{Online Company Portal Info}}'s '{{Online Order Interaction}}'?,ORDER,8065c6fc
"After locating the specific purchase in your account, what action should I take next regarding cancellation of order number {{Order Number}}?",ORDER,8065c6fc
"Once I cancel my order with number {{Order Number}}, how will I know that it has been confirmed and finalized?",ORDER,8065c6fc
Can I delete an item from my order?,ORDER,920d6f5a
What is the procedure to remove something from my specific Order Number?,ORDER,920d6f5a
Who should I contact regarding deletion of a selected article in my purchase?,ORDER,920d6f5a
"How do we proceed with taking back part of my recent buys as per request for modification, detailing said particulars required now by team assistance's solicitation hereinabove mentioned?",ORDER,920d6f5a
Your order number is? I want to cancel it.,ORDER,459e177d
How do I sign in and find my order listed for cancellation using your system steps?,ORDER,459e177d
"After finding my specific order, you mentioned initiating a '{{Online Order Interaction}}' – what exactly does that involve within the context of requesting a cancellation?",ORDER,459e177d
"If additional info is needed after starting to cancel an order through this online interface, how should I proceed and where do these prompts appear in relation to our main steps for signing out or navigating back?",ORDER,459e177d
I need ETA for order {{Order Number}}.,ORDER,7f0b85ec
Can you check when my purchase with number {{Order Number}} will arrive?,ORDER,7f0b85ec
Received message: looking for arrival time information on {{Order Number}}. Can assist?,ORDER,7f0b85ec
"Want latest update on ship date of Order Number {{Order Number}} please, where it's at now!",ORDER,7f0b85ec
How soon should I expect delivery if my purchase #{{Order Number}},ORDER,7f0b85ec
How do I begin canceling my purchase?,ORDER,6a9ac5bd
What should I look for once I'm on your site to find the order?,ORDER,6a9ac5bd
"After finding it, how can I initiate its cancellation through online interaction?",ORDER,6a9ac5bd
Will there be steps requiring confirmation throughout this process and how do I provide feedback?,ORDER,6a9ac5bd
Whom or how else can I contact if I face issues during these procedures?,ORDER,6a9ac5bd
How can I find my {{Order Number}}?,ORDER,935fe778
Where is my order with the ID of {{Order Number}} now located and how do track it?,ORDER,935fe778
I am able to locate an order on your website which has a number - Could you assist me in finding out if this links up to mine ({Order Number})? Please confirm quickly.,ORDER,935fe778
"What are steps I need to follow so that when I click on 'View Order History', my recent {{Order Number}} shows where it is?",ORDER,935fe778
What's an easy way to access my order history?,ORDER,d8bb12f2
How do I view the details of a specific order by number before canceling it?,ORDER,d8bb12f2
Can you guide me through beginning the cancellation process for an existing order on your platform?,ORDER,d8bb12f2
"Is there any additional feedback required during the order cancellation, and if so, what information is needed?",ORDER,d8bb12f2
How do I get immediate help from customer support in case something goes wrong while trying to cancel my order?,ORDER,d8bb12f2
Where is my purchase at purechase {{Order Number}}?,ORDER,3dfddf04
How do I track the location of Order Number {{Order Number}} on your website?,ORDER,3dfddf04
"I am having trouble tracking my order; how can you assist me, please?",ORDER,3dfddf04
Could we verify if there's been a mix-up with purchase number {{Order Number}} in transit statuses?,ORDER,3dfddf04
"What immediate actions should I take for Order Number {{Order Number}}, as per FAQ?",ORDER,3dfddf04
Where to see my {{Order Number}} status?,ORDER,e9c39064
Could you tell me where I can check the progress of order number {{Order Number}} online?,ORDER,e9c39064
What steps must I take for tracking down info on order no.{{Order Number}}'s state from our website’s interface?,ORDER,e9c39064
What is the current status of my purchase with order number {{Order Number}}?,ORDER,24efcda6
How can I locate and access details for my cancelled purchase using its Order Number in your portal section? Please provide specific steps.,ORDER,24efcda6
"Are there any conditions or requirements to consider when selecting 'Cancel Purchase' that might affect the process, such as processing time limits? Also clarify if customer support remains available throughout this period. Additionally, can you list all current contact methods and hours of operation for reaching our team in case I run into issues during these additional steps.",ORDER,24efcda6
"In your FAQ record regarding canceling a purchase with an Order Number, what type(s) of assistance options are still accessible if problems arise after initiating the 'Cancel Purchase' option? Please specify whether they involve direct live chat support or alternate methods.",ORDER,24efcda6
What's needed to modify my order with number {{Order Number}}?,ORDER,21db65a8
Are there any specific details or terms I should be aware of before making changes to the order?,ORDER,21db65a8
"Can multiple items in an order have modifications, and how is that done if so?",ORDER,21db65a8
Is it possible to cancel certain items within my modified order without affecting others?,ORDER,21db65a8
"Will additional charges apply due to modifying or canceling orders, and under what conditions?",ORDER,21db65a8
Can I cancel my order and how do h do it?,ORDER,5d229818
How do I find the cancellation option for my specific purchase (Order Number: {{Order Number}})?,ORDER,5d229818
"What details might be needed from me after starting to cancel, if asked by the system?",ORDER,5d229818
Where is the status of my order that have been reported as completed or successfully handled?,ORDER,5d229818
I need help with obtaining a damn product.,ORDER,eadde6a3
Could you guide me on how to acquire the desired earnings?,ORDER,eadde6a3
"What details are required for successful order placement of our item? Please provide specifics, including make and model if applicable. Avoid generic information or unrelated inquiries about company policies.",ORDER,eadde6a3
Can I place an express purchase request because my anticipation is building?,ORDER,eadde6a3
Which specific items do I want to add?,ORDER,3fc3205f
How will you adjust my order number {{}} with these changes?,ORDER,3fc3205f
What is the timeline for confirming the updated list once I provide all additional details?,ORDER,3fc3205f
"Could there be a different way, like an online dashboard or portal from where I can update my own information to avoid future hassle if possible?",ORDER,3fc3205f
Are these changes going to affect any delivery dates already set based on prior communication?,ORDER,3fc3205f
Where can I check {{Order Number}} status?,ORDER,138bdb77
How do I view my order progress for the purchase with Order Number {{Order Number}}?,ORDER,138bdb77
What is the exact process to see if my purchase of Order Number {{Order Number}} has been shipped or not yet from delivery date until arrival?,ORDER,138bdb77
Can someone assist me in checking whether something's done after a click on 'Ship Now' and view details for Orders numbered as {{Order Number}} using the website portal systematically to get an update?,ORDER,138bdb77
What is the first step to begin canceling my order with number {{Order Number}}?,ORDER,f2a2a980
"After signing in using my details and credentials at your portal info, where do I go next for interacting with completed purchases relevant to Order ID {{Order Number}}?",ORDER,f2a2a980
"Once on my purchase page linked to the aforementioned Order Number, how can I initiate the request or start interaction related to that specific order?",ORDER,f2a2a980
"Are there any additional confirmations required during this process and if so, what exactly do they entail for an order with ID {{OrderNumber}}?",ORDER,f2a2a980
"Upon successful completion of my Order Number's cancellation, how will I receive the official notification or acknowledgment?",ORDER,f2a2a980
How do I update my order with a specific number?,ORDER,37c374cf
What modifications can I request for an existing order?,ORDER,37c374cf
What is my current order status?,ORDER,90ee76c3
Which section shows real-time updates for the progress of a specific {{Order Number}}?,ORDER,90ee76c3
'{{Order Status}}' - which website feature directly informs about ongoing processes with '{{Order Number}}'?,ORDER,90ee76c3
How can I view recent tracking details pertaining to my order under this ID?,ORDER,90ee76c3
"Is there an online status update mechanism for orders, and if yes, how do I access it given the {{Order Number}} provided earlier?",ORDER,90ee76c3
I'm not sure how to buy articles right now.,ORDER,876f609e
Could you help me with finding items to purchase?,ORDER,876f609e
What steps do I have to take to make a purchase order?,ORDER,876f609e
"Can we go through the purchasing process together, please?",ORDER,876f609e
Do you need any specifics from my end for product selection?,ORDER,876f609e
"I need assistance with canceling my purchase that I see listed under order history? How do I start the cancellation process and what if I have additional questions during this time? Which support team should I contact, their available hours to help me out are also needed. Could you share your online portal's login info for immediate access on these issues?",ORDER,532a2d68
I forgot what items I wanted to buy earlier.,ORDER,867e634f
What do you mean by 'step of the process'? What steps need doing before my order arrives?,ORDER,867e634f
How can I ensure that I get a good discount like other customers had mentioned in previous interactions?,ORDER,867e634f
"Can I change an item once it has been added to my cart, or does place_order intent lock you into the list at checkout time?",ORDER,867e634f
What payment methods are accepted during this purchase process?,ORDER,867e634f
Can I modify my {{Order Number}} order?,ORDER,42370849
What are the steps for changing an existing Order {{Order Number}}?,ORDER,42370849
How does Chatbots handle request to edit Orders {{Order Number}}'s details?,ORDER,42370849
"Could someone help with adjusting changes on my current order, numbered {{Order Number}} at Service Center support.",ORDER,42370849
"For inquiries about updating an Order {{Order Number}}, which FAQ should I refer?",ORDER,42370849
I need help removing an item from Order {{Order Number}}.,ORDER,dce89886
What do I have to provide for the removal of my order's items?,ORDER,dce89886
Can you guide me through withdrawing something from my latest purchase using its number?,ORDER,dce89886
How can changes be made to what has been ordered and paid on file with this #{{Order Number}}?,ORDER,dce89886
Could I have further instructions for adjusting or revising the contents of my order identified by {{Order Number}}?,ORDER,dce89886
How can I track my order?,ORDER,de3a4055
Where do I start tracking my purchase status?,ORDER,de3a4055
Can you guide me on how to find the location of my purchases online for quick updates?,ORDER,de3a4055
I need help seeing where my item is right now; any simple steps to follow?,ORDER,de3a4055
Track order {{Order Number}} status? How to check? Response provided.,ORDER,403180c8
Where's my melodic ode ({{Order Number}}) at now? Guide for finding said tune.,ORDER,403180c8
Status update of jazzy piece ID {{Order Number}} on site unavailable; how get one using handheld device?,ORDER,403180c8
"Ease order {{Order Number}} following, steps or what next move to roll out? Guidance requested before full flow.",ORDER,403180c8
What specific changes do I need to make for my purchase correction?,ORDER,5063b3cb
"Am I allowed to correct a previous order with this service at any time before delivery or confirmation of dispatch status in the Order Details record, as seen on 'Customer's Specific Date,' and how might these amendments be processed during the endorsed period that could potentially culminate up until one day after their due date?",ORDER,5063b3cb
What information is essential to facilitate my request effectively for order modification within this context?,ORDER,5063b3cb
"Is there a formal process or procedure I must follow using tools provided here, such as contact form submissions, email correspondences with service agents like 'Customer Service Representative Name,' and what exact steps should be undertaken if further clarification is needed?",ORDER,5063b3cb
Can you elaborate on the anticipated duration for receiving assistance while correcting my purchase in this timeframe stated?,ORDER,5063b3cb
Can I track my order's current status with just its number?,ORDER,bcb575b7
Do you need more than the order number to update me on where it is now? My name or email maybe?,ORDER,bcb575b7
Are there specific details required from me for checking an order right away? Like mine here and this below?,ORDER,bcb575b7
How to modify order #{{Order Number}}?,ORDER,75236091
Could you guide me through the process for changing my purchase with number {{Order Number}}?,ORDER,75236091
What details do I need to provide regarding changes requested on order #{{Order Number}}?,ORDER,75236091
Why am I being asked about specific modification and how should proceed given I want to edit a previous order numbered as {{Order Number}}?,ORDER,75236091
"How can your customer service assist if there's an issue with my purchase needing alteration, ordered under the reference #{{Order Number}}?",ORDER,75236091
How do I create an account to view products?,ORDER,7cd10e8f
What happens after selecting desired items and adding them to the cart for purchase?,ORDER,7cd10e8f
Can you guide me step by step on how to checkout my order once selected with payment details?,ORDER,7cd10e8f
Where can I seek help if I encounter any questions or concerns while buying through your platform at different steps?,ORDER,7cd10e8f
How will we ensure a seamless purchasing experience from beginning to end?,ORDER,7cd10e8f
How can I view my order ETA?,ORDER,3ceac2a2
Where do I find the estimated time of delivery for {{Order Number}} on your website?,ORDER,3ceac2a2
Is there a direct way to check when my package will arrive using {{Order Number}} as reference?,ORDER,3ceac2a2
"Can you assist me in acquiring information about where my order is and by what date it might be delivered, specifically if I know the Order Number?",ORDER,3ceac2a2
I need clarity on how soon customers can expect delivery for a particular order; which details should one look up?,ORDER,3ceac2a2
How do I cancel my purchase?,ORDER,85fe0893
What should I click after finding the order in my history?,ORDER,85fe0893
"Do I need to provide additional information during cancellation? If so, what kind?",ORDER,85fe0893
Where or how else can I reach support if problems arise while trying to process this request on your webpage or app?,ORDER,85fe0893
Could you suggest a contact method for immediate assistance when facing issues with my concern?,ORDER,85fe0893
How can I see where my order {{Order Number}} is right now?,ORDER,46caf90f
What steps do I follow to check the status of my purchase for which the identifier was provided as {{Order Number}} on our site or via phone/chat support line at {{Customer Support Phone Number}} using Live Chat found here: {{Website URL}}?,ORDER,46caf90f
"Where in your website can I find out how far along my order {{Order Number}} has gone, with choices like tracking available through the online interaction section?",ORDER,46caf90f
Can you order several items at once?,ORDER,9d00f2f8
Please specify desired products to proceed with the purchase.,ORDER,9d00f2f8
What's your procedure for buying multiple goods simultaneously?,ORDER,9d00f2f8
Do I have option to buy more than one item per request?,ORDER,9d00f2f8
What changes can be made to my order?,ORDER,7263abef
How do I request modifications for {{Order Number}}?,ORDER,7263abef
Can edits still happen after the original purchase was finalized in relation to Order number {{Order Number}}?,ORDER,7263abef
"Would it help if I specify particular aspects needing alterations about Order {{Order Number}} and its subsequent impact on availability, delivery or any other services associated with my order?",ORDER,7263abef
Is there a step-by-step guide detailing the requisition of edits for existing Orders that are not yet processed?,ORDER,7263abef
What specific issues am I facing while cancelling my order?,ORDER,d0fb02dd
Did a particular error message appear during the attempted cancelation of {{Order Number}}?,ORDER,d0fb02dd
Can you elaborate on any challenges encountered in this process for order {{Order Number}}'s cancelation?,ORDER,d0fb02dd
"Is there additional information about how or where to attempt cancellation I should know, especially related to my issue with order {{Order Number}}?",ORDER,d0fb02dd
What steps will customer support take next after identifying the issues with order {{Order Number}}'s cancellation?,ORDER,d0fb02dd
Which items am I ordering?,ORDER,4c830f9b
How many of these desired products do I want to buy?,ORDER,4c830f9b
Do the requested amounts satisfy inventory availability?,ORDER,4c830f9b
Are there promotional offers for multiple purchases on my intended items?,ORDER,4c830f9b
Is delivery addressed and expected time provided?,ORDER,4c830f9b
"I want to purchase various items, how do I proceed?",ORDER,e2caa93a
What products are available for me to choose from?,ORDER,e2caa93a
Can you guide me through ordering these selected goods in your store?,ORDER,e2caa93a
Do my chosen grocery selections offer good quality and variety?,ORDER,e2caa93a
How can I ensure a smooth shopping experience with the items I have chosen?,ORDER,e2caa93a
To acquire our products where should I go?,ORDER,f3eb0e44
How can one view and learn about each article before buying on the website?,ORDER,f3eb0e44
[Insert question referencing browsing through selections] ,ORDER,f3eb0e44
What payment methods are available to ensure a smooth transaction when earning articles online?,ORDER,f3eb0e44
What steps should I take to cancel my order?,ORDER,86e46361
Where can I find the option to cancel a purchase on this site?,ORDER,86e46361
How do I verify and confirm an online order cancellation after finding it in my history section?,ORDER,86e46361
Under what circumstances might the system prompt me for verification or additional details following initiating the cancellation procedure?,ORDER,86e46361
What should I do if further questions arise from completing these steps?,ORDER,86e46361
Where can I order several of your products?,ORDER,6b8ef394
Can I place an order for multiple items on your site or over the phone/live chat?,ORDER,6b8ef394
"What is the process to add multiple desired products to my cart and proceed with purchasing through alternative methods like a call, if needed?",ORDER,6b8ef394
Do you offer guidance throughout shopping online in case of questions during bulk ordering?,ORDER,6b8ef394
How can I ensure a smooth and rewarding experience when ordering several items directly from your web page?,ORDER,6b8ef394
Can someone tell how my {{Order Number}} purchase is doing? I'm getting stuck here.,ORDER,1510af6e
"Is it true the package of my bought item with order number {{Order Number}} hasn’t arrived yet, even though promised to arrive already delayed",ORDER,1510af6e
"Just so you know about this Order #{{Order Number}}, can anyone share details on when exactly should we expect the delivery? The information I've gotten thus far is quite vague.",ORDER,1510af6e
"I read in FAQ that tracking an order takes time; could someone provide more precise schedule for delivering Order {{Order Number}}, please given it arrived late anyway",ORDER,1510af6e
"With reference to my purchase #{{Order Number}}, can you confirm the delay cause as I'm concerned about this recurring issue impacting my satisfaction?",ORDER,1510af6e
"I can't edit my {{Order Number}}, what should I do?",ORDER,93c8970e
Why am I unable to make changes to order number '{{Order Number}}'?,ORDER,93c8970e
Could you help me modify the details of an existing {{order_number}}?,ORDER,93c8970e
"Are there issues preventing edits for specific orders, like my {{Order Number}} one?",ORDER,93c8970e
What steps should I follow if editing is not possible for order '{{Order Number}}'?,ORDER,93c8970e
Can your service help me purchase an article?,ORDER,62bf82ff
How can I conveniently buy a specific item with you?,ORDER,62bf82ff
Is purchasing something from this FAQ possible through chat assistance?,ORDER,62bf82ff
What's my order number? Need ETA.,ORDER,47d64c5a
I want to know when my packages ship out—give me that time info please!,ORDER,47d64c5a
"Can you just tell me how late the package is gonna take and where it at now, considering I got this {{Order Number}} order with customer support hours from 9am-5pm.",ORDER,47d64c5a
"Hey, check on my big purchase status. Got Order ID:{{Order Number}}. Tracking details?",ORDER,47d64c5a
"Got me an update about when the thingy will drop at my door for Package#{{Order Number}}, help?",ORDER,47d64c5a
Can you assist with cancelling my order via online portal? It's the one I entered yesterday using a promo code.,ORDER,c3f399ec
"Could I cancel an order through live chat instead of customer support hours, if it’s urgent please?",ORDER,c3f399ec
What exactly do I see as ‘Order Interaction’ or similar phrase on my orders page when trying to cancel them online via the portal?,ORDER,c3f399ec
"If there are additional prompts while cancelling an order in a hurry, what should I expect and how immediate is the process expected to be once started through customer support channels?",ORDER,c3f399ec
Assuming complications with my attempt at online cancellation of several orders simultaneously due to timing issues or portal errors. Could you also guide me on alternative methods like phone or email contact for assistance?,ORDER,c3f399ec
Can't see my order status with its number.,ORDER,2d51034e
How can I find the current state of my placed item?,ORDER,2d51034e
"The online system won’t display my purchase info, where to look?",ORDER,2d51034e
Why isn't tracking information visible for Order Number {{Order Number}} on checkout page?,ORDER,2d51034e
What should i do when status update not found in order details after clicking?,ORDER,2d51034e
Where can I earn a few of ur item?,ORDER,2ef7d919
What options do i have to buy items online or in-store with promotions currently available?,ORDER,2ef7d919
Do you offer discounts on specific products under sale through special offers and how does it work exactly to get the discount price quickly when purchasing several units.,ORDER,2ef7d919
"Can I earn points for bulk orders, like a few items at once or in different transactions, within your loyalty program?",ORDER,2ef7d919
Would you provide tailored recommendations based on my specific product interests?,ORDER,2ef7d919
How do I get several products from you?,ORDER,a2618b16
Can help me purchase multiple items?,ORDER,a2618b16
What steps to follow for buying more than one product? ,ORDER,a2618b16
Guidance on acquiring numerous units required.,ORDER,a2618b16
Details needed?,ORDER,a2618b16
{'question1': 'Can I cancel my order because of financial difficulties?'},ORDER,36b2071b
