question,category,document
"Do all items in the order get automatically returned, or how does that process work when we cancel an entire multi-item order like mine?",ORDER,8c746634
What information do you need from me to start processing my cancellation request?,ORDER,8c746634
What steps should I follow to cancel my purchase with order number {{Order Number}}?,ORDER,3e2f6c84
"Can you apologize for the inconvenience caused during this process and ensure resolution promptness using JSON response format at '{{Company Name}}' support helpline, or online chat as applicable.",ORDER,3e2f6c84
"If any errors occur while attempting to cancel my purchase through an order interaction within my account on {{Online Company Portal Info}}, what should be the next course of action?",ORDER,3e2f6c84
"How can I expect your customer team to assist further if additional issues arise post-cancellation attempt, specifically between live chat availability and support hours during '{{Customer Support Hours}}' at '{{Website URL}}' or helpline number '{{Customer Support Phone Number}}?'",ORDER,3e2f6c84
Show purchase number {{Order Number}} status.,ORDER,cc752884
View current order number statut.,ORDER,cc752884
See where my order is? Just give me the order ID details.,ORDER,cc752884
Wish to know track of Order No.{{Order Number}}. Need info fast!,ORDER,cc752884
Could you provide a quick update for purchase {{Order Number}}'s status?,ORDER,cc752884
How can I check my order's ETA?,ORDER,fb4ff7f1
Where do I find the latest arrival updates for my package with Order Number {{Order Number}}?,ORDER,fb4ff7f1
Can you help me locate 'Order Tracking' section to view my delivery status using the provided number?,ORDER,fb4ff7f1
What actions should I take if further information about shipment times is needed after entering my order number in a specific website area?,ORDER,fb4ff7f1
Is there additional assistance available post inquiry regarding estimated arrival time via digital platform?,ORDER,fb4ff7f1
Where is my package? Tracking {{Order Number}} ETA.,ORDER,99767abf
I wish to know the expected delivery time for Order Numb. Please provide details using order tracking link.,ORDER,99767abf
How quickly I get hold of my thing with respect to given Ordnr?.,ORDER,99767abf
"Can you give me any update on where my purchase is at, which has a specific Number?",ORDER,99767abf
Just seeking the timeline post-dispatch for parcel belonging to Order {{Order Number}}.,ORDER,99767abf
How can I earn a few of our articles?,ORDER,d844a004
What do you mean by 'earning' your copyrights and how is this possible given the legal implications?,ORDER,d844a004
What's my order ETA for tracking #={{Order Number}}?,ORDER,ab3cc64d
Can you tell me when I should expect delivery of order number {{Order Number}}?,ORDER,ab3cc64d
"I need the estimated arrival time (ETA) information, please, regarding Order {{Order Number}}. Requesting real-time status.",ORDER,ab3cc64d
"Could someone give my specific ETA for tracking #={{Order Number}}, and is it on schedule or delayed?",ORDER,ab3cc64d
For purchase order number {{Order Number}}'s delivery info - any current updates?,ORDER,ab3cc64d
Can someone check my {{Order Number's current status}}? I’m quite frustrated.,ORDER,acb53b5e
"Since placing the order under {{Order Number}}, when can expect delivery/status update to see fucking where it is!",ORDER,acb53b5e
"I need details on Order #{{Order Number}}. Tracked orders always confuse me, but could you clarify that part for now? Apparently I’m not alone in this dumb issue.",ORDER,acb53b5e
See what the hell happened with my order (#: {{Order Number}}). Could there have been an error while it was processing or something?,ORDER,acb53b5e
"Just when we're getting close, why can't you see that Order #{{Order Number}} is here and delivered already?",ORDER,acb53b5e
What is your account login procedure for adding articles to an order?,ORDER,b2282897
Where can I find the 'Edit' or 'Add Items' option in my purchase details?,ORDER,b2282897
How do you select and add new items from our available choices during a purchase edit?,ORDER,b2282897
Can you guide me on reviewing my updated summary post-adding articles to ensure nothing is missed before checkout?,ORDER,b2282897
"In case of issues or further queries, how can I contact the customer support team?",ORDER,b2282897
How can I edit my {{Order Number}}?,ORDER,5ccddb4e
What are the steps to make changes for Order number {{Order Number}}?,ORDER,5ccddb4e
I need help with editing order {{Order Number}}. What should be done next?,ORDER,5ccddb4e
"Can you guide me through modifying an entry regarding My previous request, specifically pertaining to my Edited-Request on Date: YYYY-MM-DD concerning the Order number ZZZZZZ for Item ID {ItemID} with a Price of $XXX.XX, received in Reply No.: NN within {{Customer Support Hours}} period?",ORDER,5ccddb4e
"After an initial Request being processed through Edited to Status: Pending and then Closed by Customer Service on Date YYYY-MM-DD for request ID REPOID 123456 after changing Order Number, with a new delivery date requested from Delivery (Tuesdays - First Shipment) due on March Z in $XX.X Price Range of Item XYZ at Store A to be received within {{Service Window}} hours and for pick-up/collection only: where do I begin modifying an Edit Request relating specifically addressing Pending or Closed status from Order Number WXYZ?",ORDER,5ccddb4e
How do I swap products purchase number?,ORDER,15e05004
Where to contact for swapping order items?,ORDER,15e05004
During which hours can customer support alter orders?,ORDER,15e05004
What's the phone number to speak with someone about changing my order?,ORDER,15e05004
Is live chat available on our website at all times?,ORDER,15e05004
Why is my {{Order Number}} not refunded yet?,ORDER,11fef29e
How can I view and verify that the purchase associated with order number {{Order Number}} has been cancelled successfully?,ORDER,11fef29e
What should I do if the 'cancel' option for an online order linked to order number {{Order Number}} is missing or inaccessible on my end?,ORDER,11fef29e
"Can you provide me guidance through each step of the purchase cancellation process as described at customer service phone, and live chat support hours are mentioned?",ORDER,11fef29e
Where can I buy your item?,ORDER,21deeb0d
I want to acquire a few of items you offer; where should I go?,ORDER,21deeb0d
How do I purchase several copies of an item from your store or online shop?,ORDER,21deeb0d
What steps are involved in buying multiple products at one time through the company's platform?,ORDER,21deeb0d
"Is it possible to buy more than one unit of a product and, if so, how?",ORDER,21deeb0d
Can I change my order number?,ORDER,76442b10
What changes can be applied to an existing purchase record?,ORDER,76442b10
How do you handle modifications after confirming a buy?,ORDER,76442b10
Would alterations affect the price of my item if requested post-purchase?,ORDER,76442b10
Please give details about necessary adjustments so we assist effectively.,ORDER,76442b10
Correcting my {{Order Number}}? How to proceed?,ORDER,d20010a2
What do I need for order amendment on account of #{{Order Number}} missteps?,ORDER,d20010a2
"Guidance needed: Alterations desired, how modify original {{Order Number.details}}. Confirm.",ORDER,d20010a2
"How does modifying my existing {{Order Number}}, steps involved in the process with Company Name support team's help please?",ORDER,d20010a2
I intended to correct a mistake on order #{{Order Number}} - what info is necessary from me and required actions by you?,ORDER,d20010a2
I'm going to buy multiple items; how do I add them?,ORDER,9a21338c
What information should I provide for the check out process?,ORDER,9a21338c
How exactly do I complete my purchase with a few products?,ORDER,9a21338c
What specific changes can I make to my purchased item {{Order Number}}?,ORDER,54f98d4b
Is there a procedure for changing the quantity of items in order number {{Order Number}}? What details should I provide exactly?,ORDER,54f98d4b
"How does one start with updating or substituting an item in purchase order no. {{Order Number}} without causing delays, while ensuring accuracy and prompt completion by customer service team?",ORDER,54f98d4b
I'd like to modify items from my recent transaction No.{{Order Number}}. Could you guide me on the changes permitted for this particular change request along with timelines or estimated processing duration expected after receiving sufficient details?,ORDER,54f98d4b
How do I buy items from your site?,ORDER,3f91c9ff
Could you guide me through the purchasing process on your website?,ORDER,3f91c9ff
What are the steps to complete a purchase once in the Shopping Cart stage?,ORDER,3f91c9ff
Can I add items to my order {{Order Number}}?,ORDER,79c75cac
Which specific items can be added to modification request no. {{Order Number}}?,ORDER,79c75cac
"Will there be a change fee for adding more products, and how will it affect the total purchase price of my updated order?",ORDER,79c75cac
When should I expect confirmation of modified purchases with changes in item number {{Order Number}}'s composition?,ORDER,79c75cac
Can you clarify if personalized delivery has been included or excluded after ordering these additional items?,ORDER,79c75cac
How do I acquire a product online?,ORDER,b444c909
What steps should I take to make a purchase on the website?,ORDER,b444c909
Where can I find 'Add to Cart' or 'Buy Now' button for selected item?,ORDER,b444c909
"If I run into issues during checkout, whom should I contact?",ORDER,b444c909
Can you guide me throughout my purchasing process?,ORDER,b444c909
can i change something of my order?,ORDER,fa2d2810
how to modify {{Order Number}} details like quantity or size here.,ORDER,fa2d2810
what are steps for altering an item in the said number's cart possibly due to a mistake or want for different option? need brief instructions as quick guide. appreciated!,ORDER,fa2d2810
"just realized I misunderstood the product specifications, do help if possible with proper revision protocol regarding {{Order Number}}. Steps and essentials clarity requested.",ORDER,fa2d2810
Current status of my order {{Order Number}}?,ORDER,e097a3db
Where to find the '{{Order Status}}' section on our site for checking my order?,ORDER,e097a3db
Need more help after finding out about the current state; how do I ask further questions or request assistance here?,ORDER,e097a3db
Priority handling of these inquiries and any extra steps required?,ORDER,e097a3db
What are my exact options for shopping an article?,ORDER,c90c43a9
How do I select and purchase a specific item from your collection?,ORDER,c90c43a9
Could you provide detailed instructions on how to add items to my cart so that placing the order becomes easy?,ORDER,c90c43a9
"After choosing what I want, where should I proceed next in the buying process? What are some essential steps following selection but before final confirmation of an article purchase for a successful transaction under usual circumstances without special promotions or loyalty points considerations from my account (just basic cart purchasing)?",ORDER,c90c43a9
"In case there's a payment gateway option I didn't know about, how can it be accessed and selected within your system to finalize the shopping of an article?",ORDER,c90c43a9
What's the order tracking process?,ORDER,24adaf9f
How do I check my purchase status?,ORDER,24adaf9f
Do you have a tool to track my specific {{Order Number}} at this moment?,ORDER,24adaf9f
Is there direct access for myself within customer support services that can show me current product location details in real-time for the order #{{Order Number}}?,ORDER,24adaf9f
What precise information do I get after tracking an order with your service?,ORDER,24adaf9f
How do I cancel certain items from my purchase?,ORDER,398a01d6
What are the steps to remove articles?,ORDER,398a01d6
How do I cancel my order?,ORDER,3d78750e
What should I click to start the cancellation process of purchase #{{Order Number}} on {{Website URL}}?,ORDER,3d78750e
Can you guide me through accessing my account and finding a specific payment transaction from your website?,ORDER,3d78750e
Are there any additional steps or questions needed after initiating the cancellation request for order #{{Order Number}} online?,ORDER,3d78750e
How can I assist you with acquiring some items?,ORDER,d8451b97
What is the process to get things from here when ordering online.,ORDER,d8451b97
"Can someone help me place an order for various products that interest me, please provide guidance on this if possible.",ORDER,d8451b97
I'd like direction in procuring specific merchandise mentioned beforehand – what steps do I need follow?,ORDER,d8451b97
Please advise your customers here upon the needed procedure to acquire certain items previously conveyed.,ORDER,d8451b97
I'm having trouble cancelling my order as per its number.,ORDER,fbb32fc1
What should I do to cancel a purchase using the online portal?,ORDER,fbb32fc1
"How do I find and click on 'Online Order Interaction'' button for a specific sale recorded by Number XYZ in our website records of purchases, once inside their respective area within my viewport as indicated when navigating there after login through designated credentials needed to proceed with cancellation actions?",ORDER,fbb32fc1
Am i required any additional instructions besides the 'Online Order Interaction'' system-generated request or prompts for canceling orders and should I adhere strictly throughout these procedures?,ORDER,fbb32fc1
How can I cancel my order with number {{Order Number}}?,ORDER,6ce5f1f6
What do I need to sign in on the company portal for assistance?,ORDER,6ce5f1f6
Where within the account should I navigate after logging in?,ORDER,6ce5f1f6
Should I expect any system confirmation requests during cancellation?,ORDER,6ce5f1f6
How can further questions about this process be addressed?,ORDER,6ce5f1f6
What's order tracking section on website?,ORDER,0381ebc0
How to track current status for my ordered item with provided number?,ORDER,0381ebc0
Which part of the site gives real-time update about shipment and delivery notices?,ORDER,0381ebc0
"Upon any difficulty or query, who should I contact customer support for assistance in checking my order's progress online?",ORDER,0381ebc0
Where are all tracking details like estimated delivery date found?,ORDER,0381ebc0
Can I edit order number {{Order Number}}? (in Editi Order system),ORDER,aa733d83
The record mentions 'Editing.' How do I begin the process for changing my previous choice in details of an order after it has been placed regarding change_order intent.,ORDER,aa733d83
'Details about the changes' - what specific aspects can be modified within editio-mentioned context?,ORDER,aa733d83
"Thanks note implies feedback affects services. If only minor non essential edits required, does this process still apply similarly or any preferential path available for slight adjustments post placing order?",ORDER,aa733d83
What do I need to log into my account?,ORDER,e361c2a8
Where can I find the option to cancel an order in my history view?,ORDER,e361c2a8
Are there additional steps or prompts needed after initiating a cancellation?,ORDER,e361c2a8
How will I receive confirmation of my order's successful cancellation?,ORDER,e361c2a8
What should I do if I encounter issues during the cancellation process?,ORDER,e361c2a8
How can I check my order status?,ORDER,d422d599
Where do I find updates for the purchase number {{Order Number}} on your site?,ORDER,d422d599
"When will my package arrive if it’s delayed, with Order ID as reference?",ORDER,d422d599
Is there a better way to monitor an existing shipment instead of visiting in person?,ORDER,d422d599
What details are provided about late deliveries or issues for order {{Order Number}}?,ORDER,d422d599
Could you please provide more details about which specific items I'm interested to earn?,ORDER,9ce42e54
"How can we make the purchasing process rewarding and satisfying with your guidance, sir/madam?",ORDER,9ce42e54
What personalized recommendations will my preferences ensure in this purchase journey of yours?,ORDER,9ce42e54
Can I modify my order and if so how?,ORDER,4937c3cd
I wish to remove items from an existing purchase. How do I proceed?,ORDER,4937c3cd
What details are necessary for removing articles from a purchase?,ORDER,4937c3cd
"How can customer support assist me with changing orders after placing them,",ORDER,4937c3cd
How can I check my {{order number}} shipping status?,ORDER,d480a683
What's up with order N{{order number}} now? Is it on its way yet?,ORDER,d480a683
"I need to see where we stand w/my purchase, ID #{{order number}}. How do I track this?",ORDER,d480a683
Can someone tell me the delivery phase for my recent ticket 143258765TID?,ORDER,d480a683
Where can status of order {{order number}} be verified?,ORDER,d480a683
"Can I find my order with a specific number? What's that online process for checking the status on your site? And where exactly do I go to see this info? There might be more help needed or other queries too; how can you assist further in any ways, please share.",ORDER,fe793bd4
I tracked an order before and it was a different method then. Could guide me through now what's current required on your website for such task.,ORDER,fe793bd4
What do I need to share with you about my interest?,ORDER,d4add65f
How can your service assist me in ordering several items from the start?,ORDER,d4add65f
"Is assistance provided for a seamless experience throughout this process and if so, how exactly does that look like step by-step guidance or directions which include specifics such as item details to provide but not additional information beyond what is necessary directly tied back?",ORDER,d4add65f
"If an order placed under the intent 'place_order' requires follow through actions immediately succeeding initiation of conversation; should I expect prompt next action steps, and specifically in place for placing a variety or assortment within these protocols?",ORDER,d4add65f
Can I swap one product from my order?,ORDER,30fd2375
I need help swapping a damaged item in the {{Order Number}}.,ORDER,30fd2375
"How do I proceed with changing which products are included in my original purchase, referenced by Order Number {{Order Number}}?",ORDER,30fd2375
"Details please: Which is not working as desired that's for order number {{Order Number}}, and what should be a good alternative product to swap it out?",ORDER,30fd2375
What specific steps do I follow on changing one product from an existing order under your assistance at the given Order Number {{Order Number}}?,ORDER,30fd2375
Please provide product details to assist with purchase.,ORDER,a32c561d
How do I confirm my order?,ORDER,a32c561d
What payment methods are available?,ORDER,a32c561d
Can delivery be tracked once placed?,ORDER,a32c561d
Is expedited shipping an option?,ORDER,a32c561d
Can I see my ETA for order {{Order Number}}?,ORDER,d00a4d2b
How can get information about the arrival time of Order {{Order Number}}?,ORDER,d00a4d2b
"Where is My Package from Order {{Order Number}} and when will it arrive given shipping details provided herein: Date & Time, Shipping Method as known to customer service.",ORDER,d00a4d2b
May I request status on my package with delivery due today using Info like received in query timestamp and standard expected transit protocol?,ORDER,d00a4d2b
"Did the update from a previous ETA provide lead time based solely on initial shipment tracking herein: Date & Time of purchase, Shipping method given?",ORDER,d00a4d2b
How can I view my order status for purchase number {{Order Number}}?,ORDER,585c701d
"Where to find the current status of a particular buy under Order Number {{Order Number}} in Purchase History section on our site, please elaborate.",ORDER,585c701d
Could you tell me how long it typically takes post-purchase at which point I can expect my order with mentioned purchase number {{Order Number}} tracking?,ORDER,585c701d
"Does each time the update of purchase status occurs under Order No. {{Order Number}}, reflect directly and immediately in our system or is there a delay, just so that I am aware.",ORDER,585c701d
"If any issues arise regarding your order no.{{Order Number}} after payment has been made, towards which department do you direct questions for resolution?",ORDER,585c701d
I need info on ordering articles.,ORDER,7cafd327
What details do you require for order placement?,ORDER,7cafd327
Can we get started with the article procurement process?,ORDER,7cafd327
How can I make my shop experience pleasant while placing an order here?,ORDER,7cafd327
Could someone guide me through selecting and buying a specific item?,ORDER,7cafd327
How can I check my purchase status?,ORDER,78c5c1dc
What do I need to verify the buying transaction's condition on your site?,ORDER,78c5c1dc
Where will I find out about shipment of order {{Order Number}} details in our records by searching for specific purchasers section?,ORDER,78c5c1dc
"Could you direct where within customer portal my requested purchase number is visible after signing onto account with email or user ID to access orders made list, proceeding further into individual transaction review on selected search item?",ORDER,78c5c1dc
Can I earn multiple products?,ORDER,99a2bc13
Do promotions offer several rewards/products to earn?,ORDER,99a2bc13
"How can one participate in a loyalty program that lets you get more than one product and how do these offers work, please detail.",ORDER,99a2bc13
Are there ongoing campaigns allowing the acquisition of multiple products at once or over time through promotional activities/purchases?,ORDER,99a2bc13
Where can I get several articles?,ORDER,723771a3
I'm looking to purchase multiple items - where do you recommend shopping with such variety at handy online for immediate access and payment satisfaction?,ORDER,723771a3
"For a broad assortment of products, recommended place for convenient ordering suitable for quick browse-and-buy actions directly on the home page.",ORDER,723771a3
To acquire diverse range articles swiftly without inquiries – where's your top pick online storefront direct to customer?,ORDER,723771a3
"For instant access and purchase flexibility of various goods, suggested ecommerce outlet with immediate options available and no questions asked is their platform suitable for urgent order commencement?",ORDER,723771a3
Could you assist me with canceling my purchase identified by {{Order Number}}?,ORDER,a792150c
How do I proceed to void the transaction for order number {{Order Number}} in your system?,ORDER,a792150c
"Is it possible for me to get refund if I choose to return an item from my recent checkout marked as [[Order Number]] including steps on how that would be done within our online platform, please?",ORDER,a792150c
"Upon attempting the cancellation process using order {{Order Number}} via your customer portal and encountering any complications or additional information requirements, what assistance could I expect to receive?",ORDER,a792150c
What do I need to tell you for editing my order?,ORDER,9158f162
How does changing a purchase affect refunds or discounts applied previously?,ORDER,9158f162
Is there an online form available to expedite the edit process of my purchase using Order Number {{Order Number}}?,ORDER,9158f162
Do special cases such as adding delivery instructions get accounted for during order edits with that number?,ORDER,9158f162
What is ETA for my order with number {{Order Number}}?,ORDER,14c70b89
Where can I find the delivery date and tracking info of purchase #{{Order Number}} on your site?,ORDER,14c70b89
Can you tell me when to expect shipping given Order {{Order Number}} details?,ORDER,14c70b89
Is there a way to see my order's arrival timing for number {{Order Number}} online?,ORDER,14c70b89
"What does the 'track_order intent mean, and how do I use it with this specific purchase ID?",ORDER,14c70b89
How do I update my order number for purchase #1234?,ORDER,03f395f2
What are the steps to assist me with modification of a past transaction's receipt no. 5678?,ORDER,03f395f2
Can assistance be provided on altering details linked to ref#9012 in prior sale completion?,ORDER,03f395f2
Am I able to request an update or correction regarding my outstanding order ID #3456 status?,ORDER,03f395f2
"Is there a method available for me to amend information related to the purchase with no. 7890, just concluded?",ORDER,03f395f2
Which specific articles do I need?,ORDER,b54c3b0b
How many of these items should be in my order?,ORDER,b54c3b0b
Can you help me guide through the purchasing process step by step?,ORDER,b54c3b0b
What are all necessary details required for this purchase?,ORDER,b54c3b0b
Is there anything special about multiple article ordering?,ORDER,b54c3b0b
How do I cancel my {{Order Number}} via signing into your portal?,ORDER,8bbd8212
What are the next steps after locating and viewing my order details on the website for cancellation?,ORDER,8bbd8212
"Can you guide me through providing additional information or feedback during online cancellation, if requested?",ORDER,8bbd8212
Will I receive a confirmation of my cancelled order by email once it's processed; how does this system work?,ORDER,8bbd8212
What are your Customer Support Hours and Phone Number for real-time assistance with the cancellation process?,ORDER,8bbd8212
What specific changes do I want for my {{Order Number}} order?,ORDER,a07d0050
How can we repair the wrong items in my original purchase with number {{Order Number}}?,ORDER,a07d0050
"I need to fix a mistake on my previously made order, what is needed from me now that it's the case of Order Number {{Order Number}}?",ORDER,a07d0050
"To amend an incorrect delivery for Order No. {{Order Number}}, please detail which changes are necessary.",ORDER,a07d0050
