question,category,document
I'm trying to cancel order {{Order Number}} as stated in the record.,ORDER,04474359
What should I do after logging into my online portal?,ORDER,04474359
How can I find and select my specific '{{Online Order Interaction}}' section for my order with number {{Order Number}} on your site according to the instructions provided?,ORDER,04474359
Are there additional steps or is it just navigating to cancel by ordering interaction as guided in case of difficulties regarding this process from customer support during their working hours ({{Customer Support Hours}}) via phone at {{Customer Support Phone Number}} or through Live Chat on your website ({{Website URL}})?,ORDER,04474359
"If I encounter any issues while following these steps with order number {{Order Number}}, can you assist me further?",ORDER,04474359
Can I track my order by number with your help?,ORDER,bacc4a72
How do I verify account details to find out about my specific order status via customer support?,ORDER,bacc4a72
What is the process for assisting someone who needs their order's current location and expected delivery date?,ORDER,bacc4a72
"Is it possible through chat that one gets real-time updates on where an existing purchase packet has been shipped or if there's any issue with transit delays impacted by weather conditions along my parcel’s route from origin to final destination point within a country, assuming I am already logged into the customer support system?",ORDER,bacc4a72
Do your live agents connect you through direct messaging and are they able to provide information about real-time location tracking via third-party shipping services integrated in their operations?,ORDER,bacc4a72
Can I modify my order and how?,ORDER,2274d427
Is it possible to make changes after purchase?,ORDER,2274d427
What are the steps for altering a completed order?,ORDER,2274d427
How do I go about adjusting an already placed order?,ORDER,2274d427
"Are post-purchase modifications supported, and what should I submit as details?",ORDER,2274d427
Can I modify products on my order and how do I proceed?,ORDER,85fcd90d
I want to change some items from the cart in my current purchase. How should this be done?,ORDER,85fcd90d
"Having second thoughts about certain aspects of my recent acquisition, need assistance with altering item types within.",ORDER,85fcd90d
Need help updating what's on order as a result of last-minute realizations regarding product choices at checkout stage; seeking direction for modification process?,ORDER,85fcd90d
How do I navigate the replacement or addition of different goods in an outgoing purchase to match my new preferences?,ORDER,85fcd90d
When will my order arrive?,ORDER,f6a009f9
Can you estimate delivery time for Order Number *insert-order number* here please?,ORDER,f6a009f9
What's the expected delay or shipment ETA on Order {{Order Number}} for me?,ORDER,f6a009f9
"Hey, I just recalled placing an order with ID{{InsertOrderIDhere}}, and would be curious to know its arrival window. How long till it gets here?",ORDER,f6a009f9
What should I do to include an omitted item from my order?,ORDER,b4b61286
Do I need assistance in adding a missing product back into the purchase with {{{Order Number}}}?,ORDER,b4b61286
How will customer support help me rectify this oversight regarding ordering number #{{}} and forgotten items?,ORDER,b4b61286
Can our team modify an existing sale to add absent components identified after checkout but before delivery?,ORDER,b4b61286
Is there a guaranteed way by your representatives that the accidental exclusion of merchandise in order# {{Order Number}}} will be rectified?,ORDER,b4b61286
I need change Order {{Order Number}}? How do I switch something with it?,ORDER,b07e2052
What steps should follow after identifying what to swap in my order numbered as {{Order Number}}? Just tell me briefly.,ORDER,b07e2052
"Kindly guide how switching an item within the context of 'change_order' intention for {{Order Number}}. Want quick directions, please!",ORDER,b07e2052
My request is about altering a part in Order No. {{Order Number}} under change order scope; what information you need from me urgently?,ORDER,b07e2052
"'Change something in my order numbered at '{{Order Number'}' - how exactly?' Here I am looking for precise guide, cut the fluff please!",ORDER,b07e2052
Can we swap an item from Purchase Number {{Order Number}}?,ORDER,e1006e7a
What information do I need to provide for swapping a product in Order ID number {{Order Number}}?,ORDER,e1006e7a
"Upon requesting the change, how does your team facilitate the exchange process of items within my purchase order with reference Order Number {{Order Number}}?",ORDER,e1006e7a
"Does changing an item affect delivery schedules associated with Purchase Number {{Order Number}} and if so, in what manner is this communicated to me as a customer?",ORDER,e1006e7a
Could I get help picking clothes?,ORDER,8df03565
Which articles can I order here?,ORDER,8df03565
How do you assist with choosing the right size or color for my items?,ORDER,8df03565
What steps should I follow to complete a purchase smoothly on this site?,ORDER,8df03565
"Can your service recommend specific products based on preferences, like patterns or styles?",ORDER,8df03565
Can I check my package ETA? Order ID please.,ORDER,178150a4
"What's the estimated arrival time for order XYZ?, Thanks!",ORDER,178150a4
"How soon will delivery arrive based on tracking number, much appreciated.",ORDER,178150a4
Want quick update; can you tell me when it should get here? Need details by my Tracking #: 1234567890. Ordered as Standard Shipping today.,ORDER,178150a4
"Need to track shipment ETA for order tracking ID, but forgot number on hand.",ORDER,178150a4
Can I switch a product from my {{Order Number}} order?,ORDER,6cb96236
How do I request an exchange for the item in my recently placed cart on My Store account with Order ID '1234'?,ORDER,6cb96236
Please guide me through changing items in my current online purchase; it's got incorrect stock.,ORDER,6cb96236
What information is needed to complete a product swap within my existing order using number #7890 at BuyDirect.com?,ORDER,6cb96236
I need assistance on upgrading one of the electronics I ordered for Christmas through your customer service.,ORDER,6cb96236
How can I delete an item from my order with number {{Order Number}}?,ORDER,f7fc9bfc
I need to remove a product; what steps should I follow for removing one in the context of Order {{Order Number}} on your site?,ORDER,f7fc9bfc
"Can you guide me through the process, step-by-step, to take out an item from my order identified by number {{Order Number}} with no issues arising between us since contacting support?",ORDER,f7fc9bfc
"Given that I have a specific product inside Order {{Order Number}} in mind, what actions are necessary for its removal while ensuring the process is smooth as per guidelines provided on your website when asking about taking said action from an order number standpoint?",ORDER,f7fc9bfc
"What procedure must be followed to safely remove one of my selected orders identified by reference point Order {{Order Number}}, maintaining clarity in communication and efficiency without complications during a customer service engagement based upon FAQs?",ORDER,f7fc9bfc
What exactly is needed to cancel my order with number {{Order Number}}?,ORDER,e7defe27
"Can you walk me through the steps of initiating an order cancellation for purchase ID {{Order Number}} on the portal at [[Customer Support Hours]] via phone or live chat available from your site during this time, please provide assistance.",ORDER,e7defe27
Following up to our earlier conversation about Order Cancellations using my specific Purchase Reference Numbėr ({{Order Number}}) under Signin on Your System with Clickable 'cancel' Option; what sort of Additional Prompts or Questions might I expect?,ORDER,e7defe27
"Might issues arise during the cancellation process for Order {{Order Number}} and how quickly will our Team Address these Problems, as they aim to ensure my satisfaction.",ORDER,e7defe27
Can you extend your typical Customer Support Operating Timeframe in case unexpected delays or complications prevent me from completing cancellation within that range?,ORDER,e7defe27
Which articles do I want to swap out?,ORDER,71d1dbb1
What replacements am I looking for?,ORDER,71d1dbb1
Can we process the order swap right away?,ORDER,71d1dbb1
"Is there any additional information you need from me now, like item descriptions or sizes?",ORDER,71d1dbb1
Thank you in advance for your patience and help.,ORDER,71d1dbb1
What is the first step to buy your items online?,ORDER,d6601d78
How do I view product information for selected items on your website?,ORDER,d6601d78
"Where should I click after adding an item to my cart in order not to continue shopping but proceed with checkout and payment details, assuming there are multiple instances of 'cart' or similar phrases needing clarification.",ORDER,d6601d78
In what format is the purchase confirmation sent via email once ordering completed as mentioned about being able track status?,ORDER,d6601d78
What is the current status of my order number? See 'Order History'.,ORDER,bf771f57
How do I view an order history on your site? Visit 'Order History' section.,ORDER,bf771f57
"I have questions about Order {{Order Number}}, where to find help there? Check website for guidance in 'Order History'.",ORDER,bf771f57
"Can you assist me with checking my order status using the provided number?, Please guide users through online viewing process and offer additional support if needed. I prioritize your satisfaction highly.",ORDER,bf771f57
"I need updates on an order, is tracking it still viable? Confirm continuous monitoring options for customer reassurance.",ORDER,bf771f57
When will my purchase arrive?,ORDER,a98b8fba
Can I find out when it'll be delivered based on order #{{Order Number}}?,ORDER,a98b8fba
How do I get the ETA for my specific purchase (#{{Order Number}})?,ORDER,a98b8fba
"Is there a way to track delivery details online using {{Order Number}} as reference—what is this process, please tell me.",ORDER,a98b8fba
"I wish to see when my product will be shipped from its current location; can you assist with order #{{Order Number}}, and how exactly do I request for ETA info?",ORDER,a98b8fba
Can't check my Order Number status.,ORDER,f352162c
Need to track a purchase with its number?,ORDER,f352162c
How do I find the order status of my recent buy using an order reference or identification number?,ORDER,f352162c
"Assistance please, locating what happened to my item that had been bought recently. Any steps should only require mentioning Order Number.",ORDER,f352162c
Order confirmation doesn't reflect updated location—help with finding where items are?,ORDER,f352162c
Order Honored? See Order Number status.,ORDER,1d2fea9d
Where is my {{Order Number}} now? Need to know soon.,ORDER,1d2fea9d
Can I check what happened with order number {{Order Number}} yet?,ORDER,1d2fea9d
Could someone confirm the current state of order number {{Order Number}} for me please quickly? Thanks!,ORDER,1d2fea9d
Isn't there any way we can get a hold on my Order Number status right now?,ORDER,1d2fea9d
Can I cancel my order with a specific number?,ORDER,1523a751
What's the process to cancel an online purchase through My Company Portal?,ORDER,1523a751
"I see cancellation on record; how is it done when founding out before getting help, and am facing issue during completion step.",ORDER,1523a751
Is assistance available from support team for issues encountered in order cancellations via chat or phone? What are hours of operation?,ORDER,1523a751
Where's my ordered stuff? Like when will it arrive for {{Order Number}} purchase?,ORDER,43e3ee31
How can I find my order's estimated arrival time?,ORDER,5cc0d43d
What steps do I need to take to track the delivery status of an order using its number on your website?,ORDER,5cc0d43d
Where exactly in your site are ETA updates accessible with a specific tracking code or order number?,ORDER,5cc0d43d
Is there any way you can assist further after finding my package's ETA if needed?,ORDER,5cc0d43d
What else should I know about monitoring deliveries?,ORDER,5cc0d43d
Where is 'Cancel Order' located within {{Online Portal Info}}?,ORDER,b6b05dd2
What are the next steps after identifying my order number on this page?,ORDER,b6b05dd2
'Online Order Interaction'' option: what do I need to understand it requires from me for cancellation purposes?,ORDER,b6b05dd2
"Are there any additional actions or information needed during 'cancellation process' based on your instructions, and how should these be addressed if encountered while using the system live? ",ORDER,b6b05dd2
"In case of issues with order cancellation online via {{Website URL}}, what are my options to reach out for personal assistance?",ORDER,b6b05dd2
What's my {{Order Number}} status? Can you check it for me right now please? I can’t wait to know its progress.,ORDER,d1c73d94
"How do I view the update regarding the purchase identified by {{Order Number}} on our website? Quick info, anyone?",ORDER,d1c73d94
Is there a way I could find out where my order with {{Order Number}} is at in real-time while online shopping? Fast response needed!,ORDER,d1c73d94
"I'm trying to keep track of what happens next for the purchase registered under name or email linked with {{Order Number}}. Who should get back to me on this matter via website? Speed, please.",ORDER,d1c73d94
What are my immediate actions required after reaching '{{Purchase History}}' regarding tracking down progress of Order No. {{Order Number}}?,ORDER,d1c73d94
Why can't I change my order?,ORDER,fdebf0aa
"What should we do if someone else changed it already from mine to another one by mistake or on purpose and how exactly will your team help in this situation, assuming you could provide more details about what happened with the other person involved.",ORDER,fdebf0aa
In general when can changes be done for an order?,ORDER,fdebf0aa
Could I get some information if my refund request has already been processed because of issues related to not being able to change it as specified previously?,ORDER,fdebf0aa
What's my order status?,ORDER,2584bdb7
Can you check if my package was delivered yet?,ORDER,2584bdb7
When is the delivery date for Order ID {{Order Number}}?,ORDER,2584bdb7
Has my tracking number arrived at its destination?,ORDER,2584bdb7
"Is there any delay with my shipment, and what's causing it?",ORDER,2584bdb7
How do I delete a product from an order?,ORDER,e7cb57a7
Can someone help to remove the damaged item listed on my purchase number {{Order Number}}?,ORDER,e7cb57a7
"What details are needed for removing specific products from orders and how can they be provided quickly, please guide.",ORDER,e7cb57a7
Thanks in advance. How is service improvement handled with these deletions requests?,ORDER,e7cb57a7
How do I start with our selection?,ORDER,0ae6c8a6
What steps should I follow to create an account on your website or app?,ORDER,0ae6c8a6
Can you explain how the loyalty program helps me earn points for items and where can find special offers?,ORDER,0ae6c8a6
"Where on my account settings will I be able to see my point balance, so that I know when to redeem them.",ORDER,0ae6c8a6
How do I redeem my earned points on your website or app?,ORDER,0ae6c8a6
What's your process for placing an order?,ORDER,e67a49f2
"Do I need to specify what products I want to buy in the 'Can you help me order a few of your product?' question or is it implied by my previous interaction with customer support, based on this FAQ response.",ORDER,e67a49f2
How do I get assistance from you throughout placing an order?,ORDER,e67a49f2
Could there be any specific steps involved that differ slightly for bulk orders as suggested in the response when 'I want to buy just a few items' but later mentioning several products implies preparations like selecting quantities or checking stock availability.,ORDER,e67a49f2
"What happens after I have successfully placed my order, from this information?",ORDER,e67a49f2
I need aid to take out an item from Order #{{Order Number}}.,ORDER,e7532551
Which specific item shall we remove from my order identified by the number #{{Order Number}}?,ORDER,e7532551
"Have I faced any inconvenience, and how can you assist me in this matter regarding my purchase (order concerned)?",ORDER,e7532551
How swiftly should I expect a response on your part for expediting aid to alter an item within Order No. {{Order Number}}?,ORDER,e7532551
How do I see my purchase status with a specific Order Number?,ORDER,0c3c1387
What page contains the 'Order History' section on your website?,ORDER,0c3c1387
Can you guide me through checking my order ETA using just the Order Number?,ORDER,0c3c1387
"Is there trouble locating an order in the history by its number, and how to fix it?",ORDER,0c3c1387
How do I contact support if needed during the status check process?,ORDER,0c3c1387
What's my order shipment arrival date for {{Order Number}}?,ORDER,f21bfed2
Tracking the ETA of what purchase number am I looking to track?,ORDER,f21bfed2
Can you check when is estimated delivery time (ETA) for Order Number {{Order Number}} as mentioned in FAQ response.,ORDER,f21bfed2
Does your answer help find out if my package has been misplaced?,ORDER,f21bfed2
How do I cancel my purchase with Order Number {{Order Number}}?,ORDER,866eeee2
What are the steps to initiate an order cancellation through your portal?,ORDER,866eeee2
"Where in your account menu is there a section for managing online orders by number as referenced when ordering something and needing assistance post-purchase, like contact information available via phone or live chat during office hours given in this context with their support details included within the FAQ excerpt provided at https://{{FAQ URL}}?",ORDER,866eeee2
"Can I get confirmation after canceling my order {{Order Number}}, what should happen next according to your online procedures and customer service commitment outlined here, including direct contact information for any follow-up issues?",ORDER,866eeee2
"Could you specify the procedure as stated within this excerpt when needing live assistance during business hours via phone or chat directly available in support section of {{Website URL}}, especially if there is a concern after taking online steps outlined previously, while referencing cancellation details related to any specific order?",ORDER,866eeee2
Where do I go to track my order?,ORDER,67e463f7
Do I need to log into my account first?,ORDER,67e463f7
Could you tell me the link or steps for tracking an order after purchasing it with a specific number?,ORDER,67e463f7
"Is there assistance available if I face issues while trying to get help regarding my order status, and how is customer service committed?",ORDER,67e463f7
I am getting an assistance with a order process.,ORDER,90909395
Which articles do I choose for my desired place on your website?,ORDER,90909395
Please direct me to the next action following our conversation about placing orders.,ORDER,90909395
How can I add an item to my order number?,ORDER,e02e69ea
What kind information do you need for adding a new item in the existing order of {{Order Number}} as per your help request?,ORDER,e02e69ea
Could you please guide me through the process and necessary steps involved with changing or updating/adding items on my said Order #{{Order Number}} based from FAQ?,ORDER,e02e69ea
"Based from answer record, can I comprehend that a change in order is allowed by adding an item; how do we go about this modification for current purchase to reflect the addition of chosen product(s)?",ORDER,e02e69ea
"Upon considering my intent 'change_order' as stated before handing over request on {{Order Number}}, if assistance required includes extra add-on or change post check out but prior fulfillment; is it feasible procedure?",ORDER,e02e69ea
Can ETA for my purchase {{Order Number}} be checked?,ORDER,524120fb
How do I find out the delivery time (ETA) of Order #{{Order Number}}?,ORDER,524120fb
Could you specify which articles I need to change for order #{{Order Number}}?,ORDER,96e6b71c
What changes should be made based on the FAQ answer provided earlier?,ORDER,96e6b71c
"Are there any procedures or information needed from me in addition to specifying details, according to your response?",ORDER,96e6b71c
Can you tell order progress? Need update.,ORDER,6be7c694
Status for my specific purchase ID—please?,ORDER,6be7c694
How to find out what's going on with the package I bought using its unique number here?,ORDER,6be7c694
Could someone look into my sequence-tagged transaction and give me an info shot ASAP?,ORDER,6be7c694
"Where’s my merchandise, identified by this alphanumeric label?",ORDER,6be7c694
Can you check my order ETA for number {{Order Number}}?,ORDER,fe2bfc74
What’s the latest time I can expect delivery of order {{Order Number}}?,ORDER,fe2bfc74
"I want to know when will my purchase with Order ID: {{Order Number}}, arrive.",ORDER,fe2bfc74
"How long after ordering does shipment begin, for Order #{{Order Number}}?",ORDER,fe2bfc74
what steps are involved to cancel my order?,ORDER,dd992557
"where do I find 'cancel' or similar options for an order status in the portal if needed later, because not every transaction requires it yet.",ORDER,dd992557
how can one confirm that a payment refund is processed after ordering has been terminated successfully? Is there documentation available within the records to verify this action outside of customer interaction channels too soon post-cancellation completion?,ORDER,dd992557
"in case my order status does transition through an 'order complete' tag, but then I wish for it not only canceled and refunded—if something fails in process or unexpectedly unfolds before receiving the full resolution notice from support team; what alternative strategies should be considered to resolve such discrepancies?",ORDER,dd992557
"can detailed records of communication through customer service channels, post-interaction up until issue's complete closure with regard to order cancellations and refund processes (if applicable), also reflect specific concerns or problems encountered during said interaction in future dialogues?",ORDER,dd992557
Could you guide me through earning an item?,ORDER,3b728de2
"What do I need to know before buying something with a view of collecting items for free or discounts (e.g., points, coins)?",ORDER,3b728de2
"Is there specific information mentioned on product pages about how can one get certain benefits while purchasing those products? If yes, where should I look?",ORDER,3b728de2
"Are any spending thresholds to be met at checkout for earning bonus items or discounts during purchase process, and if so, what are these thresholds?",ORDER,3b728de2
Do you have further assistance in navigating this process of acquiring through purchases a specific item (if there's such an option available)? Please let me know.,ORDER,3b728de2
how to assist with ordering several products?,ORDER,a55627b4
What should I do after adding items to cart and before completing the order on your website at {{Website URL}} ?,ORDER,a55627b4
Who can help if I have difficulties or need answers while placing my multiple product orders during Customer Support Hours from {{Customer Support Phone Number}}?,ORDER,a55627b4
"Is it possible for me also to ask questions and get guidance in live chat on your website regarding multi-product purchases, how do I start the conversation with representatives present there ? ",ORDER,a55627b4
Can you summarize quickly how exactly should one place an order of several items smoothly before checkout?,ORDER,a55627b4
How can I purchase multiple products at once?,ORDER,ebeb1269
What are the steps to check out with several items in my cart?,ORDER,ebeb1269
Can you guide me through adding and shopping for various articles simultaneously?,ORDER,ebeb1269
"Is it possible to shop more than one item from your store, and if so, how do I proceed when prompted at checkout?",ORDER,ebeb1269
What assistance can customer support provide during the shopping process with multiple items?,ORDER,ebeb1269
How do I purchase several items from your store?,ORDER,2363f2d3
Can you help me buy multiple things here?,ORDER,2363f2d3
What's the procedure to order more than one item with my request?,ORDER,2363f2d3
"I see interest in various products, can support proceed through this process please.",ORDER,2363f2d3
The FAQ doesn’t directly state it. How do I begin buying several items?,ORDER,2363f2d3
Can I switch several products? Order {{Order Number}}.,ORDER,da4cd96f
"How to proceed with switching multiple items in my order? Reference the specific details and product names or SKUs required for processing this request accurately. What changes are available, if any restrictions apply?",ORDER,da4cd96f
I'm having trouble navigating to my orders on your website.,ORDER,8bd3f505
What is the next step after I click 'Online Order Interaction'?,ORDER,8bd3f505
Do additional confirmations always follow an online order cancellation request?,ORDER,8bd3f505
How do I access customer support if issues arise during this process?,ORDER,8bd3f505
Is there a specific time when live chat on your website tends to be less busy?,ORDER,8bd3f505
What's my purchase {{Order Number}} status?,ORDER,7d426709
How can I find out where your item on order number {{Order Number}} is now using our website history section for purchases?,ORDER,7d426709
"Do you help with keeping track of the delivery progress or current state of orders identified by specific numbers, such as my bought goods' one marked by {{{Order Number}}}",ORDER,7d426709
where can I purchase several of your product?,ORDER,261d9494
how do I add products to my cart and proceed with checkout on the website?,ORDER,261d9494
can you list all available physical store locations for purchasing your items?,ORDER,261d9494
